Our findings suggest that DM and associated hyperglycemia with insulin resistance rather than obesity itself is responsible for the development of acute organ failure and subsequent adverse outcomes in this middle aged US population  ,hypothesis
A significant age dependence of the postural measures has been demonstrated    from a longitudinal study Kirschenbaum et al    showed that the control strategy to maintain balance does not follow a simple linear relationship with age but a step like transition at the age of to years occurs  ,hypothesis
We consider the hypothesis that Notch IC activates the transcription of   Catenin thus partially compensating its inhibitory influence on   Catenin through the Wnt pathway  ,hypothesis
The simplest interpretation of the available data is that GC activation is the primary means by which the intracellular concentration of cGMP is increased during excitation in Limulus photoreceptors  ,hypothesis
The presence of a classical NAGS  gene argA  along with the argH  A  sequence in some organisms  vibrio like enterics  having an AO  ArgE  but no OAT  ArgJ  could be explained by the fact that such organisms are unable to recycle the acetyl group and therefore require a larger flow of acetylglutamate  ,hypothesis
Hence reductive evolution might be responsible not only for decreasing the gene repertoire of Buchnera but also for reducing its network modularity  ,hypothesis
These findings suggest the following research hypothesis  spatial autocorrelation contained in a disease map has its negative components fade and its positive components strengthen through time  ,hypothesis
And the following is a third hypothesis  states without reported WNV cases are from the same statistical population as states with reported cases  ,hypothesis
Consequently larger genome organisms advance faster which leads to increased average complexity  ,hypothesis
H Selected food items  i e  red wine meat  or mineral supplements are the major contributors of high STHQ  metal   ,hypothesis
Since many low grade systemic inflammatory conditions may have their origins in the perinatal period   I propose that PUFAs be given to pregnant women and lactating mothers and to children from infancy throughout life to reduce the burden of both infectious and non infectious diseases  ,hypothesis
Our results suggest an intriguing possibility that regulation of retinoic acid formation in the HL cells and the subsequent terminal differentiation to granulocytes could be mediated by one enzymatic acitivy e g  a CYP mediated oxidation of retinal whereas regulation of retinoic acid formation in the hematopoietic stem cells and the subsequent maintenance of the self renewal capacity of the hematopoietic stem cells is mediated by ALDHAoxidation of retinal  Figure   ,hypothesis
We posit that the conservation of centromeric sequences between lineages will be reinforced the more reuse the breakpoints associated with these centromere locations experience  ,hypothesis
Such a hypothesis is plausible if the sequence pattern of RPPinfluences the likelihood of developing systemic sclerosis  ,hypothesis
In the common ancestor of Frankia CcIand ACNa a reshuffling of the genome could be responsible for disrupting of the genomic context which is maintained among Noca Acel FraneanSCOand SAV Fig    ,hypothesis
These results add weight to the hypothesis that the cerebellum predicts the state of the motor system  ,hypothesis
A third hypothesis states that the ancestral eutherian karyotype is a combination of both clades  ,hypothesis
Despite this the size of differences are such that we think it unlikely that they would have important impacts on cost utility analyses  ,hypothesis
Although gene order does not appear to be conserved across the monocot dicot divide the repertoires of gene products  that is the typical monocot and dicot proteomes  may be conserved  ,hypothesis
It is also consistent with sex biased mutation rates for minisatellites and the lack of association between survival rate and mutation  ,hypothesis
Thus identified SNPs in the binding sites may have no influence on the binding site integrity and therefore will not affect transcription factor binding and gene expression  ,hypothesis
Nevertheless it is possible that these proteins do have a causative function in determining the extent to which other signaling proteins are activated  ,hypothesis
Such feelings underlie an unresolved debate over the optimal balance between factual   teaching  or content based  and practical   training  or performance based  components of professional development   and as such could explain a recent drift away from the didactic emphasis of older biomedical educative approaches   and towards quasi experiential or problem based learning    PBL   Figure A   ,hypothesis
It is possible that RNAs with conserved YCAY clusters more often encode proteins that are indispensable for synaptic development and function while the RNAs with YCAY clusters present only in mammals more often encode proteins that modulate synaptic function  ,hypothesis
In the case of A  ferrooxidans it has been shown that the bacterium accumulates substantial numbers of polyphosphate granules  nmol of Pi  mg of protein  under Pi sufficient growth conditions   raising the possibility that these granules might also store iron  ,hypothesis
They hypothesized that the SP driven feed forward inhibition may serve to balance neuronal activity by counteracting SP mediated excitatory nociceptive responses  ,hypothesis
If the gene expression patterns observed in the present study translate to greater Tiereceptor signaling then our data supports the idea that ANGcooperates with other growth factors in vivo to regulate and promote functional angiogenesis  ,hypothesis
The presence of repeated or similar ORFs is perhaps a device to ensure enough translation of LDPTGXY containing peptides  ,hypothesis
These experiments aimed at showing the potential role of anaphylatoxins to produce neurotrophins in order to protect neurons from injury  ,hypothesis
Thus if there are other benefits which are not detected by the WOMAC then this may also explain why the mapping formulae tends to under predict the actual QALY gains associated with each of the four interventions  ,hypothesis
As described MDMis inactivated by DNA damaging agents which includes chemotherapies  ,hypothesis
We hypothesize that consensus of TK of specific plants used for different illness categories are high indicating reliable TK among informants at a local scale  within one localized aboriginal group or community   Irulas of the KRF  because it has been used within their culture without interruption for many generations  ,hypothesis
To investigate this analysts test a partial measurement invariance hypothesis  ,hypothesis
A variant of this theory also only applicable to primates is the  altriciality lifespan  model  ,hypothesis
Although the authors did not observe any leukemia in SuzPlt  mice oncogenic insults and additional mutagenic events may be required for full transformation of SuzPlt  cells  ,hypothesis
Although speculative the hypothesis that the concept of supersensitivity may additionally extend to the nigrostriatal tract could explain the associations found in the current study  ,hypothesis
Indeed the specification of telencephalic and eye fields appears to be closely linked   and the initial expression of olSix in both regions appears to depend on the activity of a single enhancer element  D  and a distal silencer  A  which constrains the expression domain to the anteriormost neural tube  ,hypothesis
It is possible that PAZ may contain some molecule  s  able to act on basal metabolic rate  BMR  thus increasing energy expenditure and leading to consumption of excess fat stores  ,hypothesis
Based on previous findings indicating biological differences  e g  regarding the destruction of the cartilage  and psychological differences  e g  perception of pain  we hypothesized that men and women differ regarding many aspects of QoL and received care  ,hypothesis
The Internet familiarity of the physicians  Table  is responsible for the importance they attach to advertisement on the web and particularly to the own website  ,hypothesis
One hypothesis is that increased pigmentation in these environments does not increase background matching and pigmentation only increases due to correlational selection on crushing resistance  ,hypothesis
It is possible that such different response stems from polymorphisms in the IL receptor andor down stream signaling molecules that determine the secretion of cytokine from IL induced monocytes  ,hypothesis
Notably MCD expression is elevated in heart of PPARa KO mice concomitant with impaired fatty acid oxidation    ,hypothesis
The shift to a Glu residue in the natural malarial enzyme replaces the single nucleophilic centre of Cys with negative charge distributed over the two side chain oxygens of Glu which could explain our observation of two products generated in comparable quantities by the parasite orthologue  see Fig  Sand legend for a proposed mechanism   ,hypothesis
Since long chained PUFAs decrease tumor proliferation by increasing free radical production   increase in FABPexpression of glioma following DHA supplementation could reduce prooxidant effect of DHA in tumors and consequently reduce their anti tumor effects  ,hypothesis
We suspect that the evasion may be reinforced by suppression of T cell responses by HPS  ,hypothesis
Full details of this new model are given in Figure A and B  ,hypothesis
The authors note that MuDR has inserted adjacent to a GA rich sequence and suggest that this may be important for the reprogramming of both MuDR and Hemera during their passage to the next generation  ,hypothesis
Based on our findings with A  vaginae specific PCR which recovered this species in  PPERCENT of the grade I specimens it appears as if A  vaginae may be a constituent   presumably in low numbers   of the human vagina possibly attaining replicative dominance in association with decreasing lactobacillary grading  ,hypothesis
However the low amounts of transcript levels detected in Ls following RNAi suggests that RNAi is nearly systemic  ,hypothesis
Horizontal gene transfer has been a favored explanation for occurrence of such inter domain homologs   and may also be invoked to explain the occurrence of eukaryal homologs in planctomycetes  ,hypothesis
It seems possible that one of the two syntaxins specialized to the process of homotypic vacuole fusion  ,hypothesis
These results taken together suggest that immunity for insects is high in the hierarchy of important physiological systems that is when an immune response is required the bee will eat more  our data  when food is restricted energy from other systems will be diverted to keep the immune response at full strength     and only if other activities are enforced on the insect   will immunity be compromised  ,hypothesis
The study of Blagburn et al    is inconclusive as to whether there are a greater number of chemical synaptic zones in shak Bflies compared to wild type  ,hypothesis
Altogether these results suggested that the prfA mutant strains KRKRand KRwere deficient in translation termination activity at UAG codons  ,hypothesis
According to our findings dimensions of perceived chewing ability may exist  ,hypothesis
Thus CPT may inhibit COLAby a mechanism involving activation of NF  B  ,hypothesis
No matter the expression vector used E  coli growth was halted when the expression of PF   was induced suggesting that this protein may be toxic for E  coli  ,hypothesis
Preferential insertion sites  hotspots  have been suggested for some Drosophila elements   and we can not completely discard the possibility of an activation of transposition to specific hotspots during the colonization process  ,hypothesis
It could be speculated that some professional groups such as the health service employees had joined the network to observe upcoming PHCRED program activities and were not necessarily actively seeking personal capacity building in research at this time  ,hypothesis
Lepe et al  described a case of childhood HP without dental manifestations in adulthood    ,hypothesis
Because of the nitric oxide  NO  synthase may be stimulated by the EMF exposure   and this compound has been involved in the stimulation of lipid peroxidation during the initial states of ischemia reperfusion injury   it is possible that increased free fatty acid deposition in the liver after ELF EMF could occur as a consequence of the NO production  ,hypothesis
Recently Zassenhaus and colleagues proposed an intriguing mechanism whereby mtDNA mutations would generate a pool of misfolded mitochondrial proteins some small proportion of which might have the conformation necessary to bind to Bax or Bak and thereby activate apoptosis or perhaps bind to Cyp D and inhibit its chaperone function    ,hypothesis
The overlap between the H  andersenii  trnK  uuu   and tatC suggests that  trnK  uuu   may play a role in processing the  end of the tatC gene transcript  ,hypothesis
They hypothesized that there are contingency genes spread across the population that provide improved population survival  ,hypothesis
The line cross model used for QTL detection assumes that different QTL were fixed in the Lines DD and LTI    ,hypothesis
The hypothesis that there was no difference in the pattern of substitutions  dN dS  between these two groups was tested in a codon based maximum likelihood framework  ,hypothesis
Thus we propose that the genetic interactions between disease causing mutations and mildly destabilizing protein polymorphisms are mediated at the cellular level by competition of their respective gene products for folding resources  ,hypothesis
If DUS evolved as a mechanism to obtain homologous DNA for repair purposes it would make sense that only closely related species shared the same DUS  ,hypothesis
Those workers studying leukocyte interactions with blood vessels have also had a very clear hypothesis in the form of the multistep paradigm which argued for rolling activation and arrest steps executed by selectins chemokines and integrins    ,hypothesis
In Riley et al    the authors theorize that the duplication of the CHRNAlocus is a human specific event because of the high sequence homology of the duplicated segment to the donor segment in q and the fact the CHRNAduplication appeared polymorphic in the human population    ,hypothesis
Despite the overall negative findings of this report it is possible that dietary patterns rich in soy food may have a beneficial effect on markers of obesity andor chronic inflammation in specific populations  ,hypothesis
Therefore it is conceivable that DC derived exosomes from melanoma patients are specifically endowed with NK cell stimulatory capacity in vivo  ,hypothesis
It is likely that PCT may be particularly useful in patients with an intermediate pretest probability and maybe not in patients with a low or high pretest probability  ,hypothesis
Thus unlike in intergenic regions an insertion into a transposable element isnt neutral in introns leading to a higher probability that such nested insertions will be lost during evolution  ,hypothesis
Homeostasis could thus be specifically restored in these networks during REM sleep  ,hypothesis
Therefore it is possible that contemporary populations of M  rutilus in southeast Alaska previously had higher levels of diversity but lost diversity  e g  through bottleneck events  after hybridizing with M  gapperi  ,hypothesis
Specifically it was hypothesized that mortality differences may be attributable to a higher proportion of female immigrants from higher risk countries  ,hypothesis
Therefore it is possible that sudden postural changes  i e  a change form the upright exercising posture to the supine left lateral position  that occurred in current investigation may have resulted in increased right ventricular end diastolic cavity area that via diastolic ventricular interaction  with or without pericardial constraint  may have reduced LV compliance and filling  ,hypothesis
Cross hybridization would only occur in small groups and each group would be independent of the others  ,hypothesis
Our working hypothesis is that these ORFs may be highly divergent and therefore unrecognizable versions of  missing  respiratory or ribosomal protein genes    ,hypothesis
The working hypothesis that blood cell TL can indicate a later development of a malignant tumor was not supported in the present study  ,hypothesis
A second school of thought suggests that the primordial vertebrate LDH was an LDH C like enzyme  ,hypothesis
He proposed instead that the  substance  that was excited by adrenalin was the  myoneural junction  i e  the link between nerve ending and muscle cell which he believed to originate from and to be sustained by the muscle cell  ,hypothesis
We propose that insulin resistance can bring about two phenotypic transitions that we call  r to K strategist  and  stronger to smarter  respectively  ,hypothesis
But Hh also promotes myoblast proliferation indirectly by eliciting muscle growth factors from non myogenic limb cells  ,hypothesis
Bivariate analysis of yeast data revealed a strong negative correlation between gene expression level and evolutionary rate   which led to the recent proposal of the translational robustness hypothesis asserting that selection against toxicity of misfolded proteins generated by translational errors is the single most important factor governing the rate of protein sequence evolution      ,hypothesis
The FDA reports that most PPAR agonists in development are non thiazolidinediones and though more than Innovative New Drug  IND  applications have been filed for this group of drugs in the last seven years most development programs have been terminated all for safety reasons and none have been approved  ,hypothesis
Glitazones reduce androgen biosynthesis increase their binding to SHBG and attenuate androgen receptor activation thus reducing the physiological actions of testosterone causing relative and absolute androgen deficiency  ,hypothesis
Therefore we suggest that topoisomerase II inhibition might be the reason for the chromosomal clustering of Aroclor trovafloxacin  doxorubicin  and etoposide regulated genes  ,hypothesis
We suggest that the S  cerevisiae Csm Lrscomplex adopts a function similar to that of Pcs Mdeonly during meiosis I when the former is released temporarily from the nucleolus  ,hypothesis
Therefore the bp satellite on the paternally inherited D  melanogaster X chromosome will be de repressed in early hybrid female embryos  Figure   ,hypothesis
Thus they suggest that serum TGs are likely a major cause of the leptin resistance seen in both obesity and starvation    ,hypothesis
Therefore ST may form trivalent interactions with the PPA AC complex two of them  via the J domain and the second zinc binding motif  interacting with the A subunit and the third one  via the first zinc binding motif  binding to the C subunit  ,hypothesis
In this scenario lowering LDL and raising HDL are clinically beneficial because they affect the plasma and tissue concentration of the  initiators  of atherogenesis even if the  permissive  factors are not modified  ,hypothesis
In the clinical scenario Tieleman et al   speculated that pre treatment with verapamil or diltiazem was responsible for reduced AF recurrence in the first month after electrical cardioversion due to attenuated or rapidly reversed tachycardia dependent remodeling  ,hypothesis
The most widely accepted model that has been proposed to explain the evolution of genomic imprinting is known as the parental conflict hypothesis    ,hypothesis
The first of these is commonly known as the  cues filtered out  hypothesis    ,hypothesis
An alternative view which I propose here the  finishing kick  hypothesis is an outgrowth of the work of Muller et al    Sillje et al    Schneider et al    and many other authors  ,hypothesis
It was suggested by Pickup and colleagues in that  syndrome X   now called the metabolic syndrome  was in fact a disease caused by the chronic activation of the innate immune system and contributed to the hypertriglyceridaemia low HDL cholesterol hypertension glucose intolerance insulin resistance and accelerated atherosclerosis of NIDDM    ,hypothesis
Thus dexosomes appear to act as a vehicle for disseminating antigen amongst DC representing a potentially important mechanism of immune response amplification  ,hypothesis
Although the hypothesis in Figure is in conflict with a recent analysis of coding genes from whole genomes   as well as is in conflict with other studies  Table S the scenario presented here is consistent with another set of studies and also with one of the major urmetazoon hypotheses the placula hypothesis  Figure   ,hypothesis
Sequence homogenisation through extensive gene conversion was initially proposed by Baltimore to explain the homology observed between MHC genes within a species    ,hypothesis
Furthermore our results suggested that M  globosa especially in the mycelial form is the main agent of PV and M  furfur is the second agent in importance  ,hypothesis
Perhaps fibers evolved to aid in bird dispersal as suggested    ,hypothesis
It will be of considerable interest to study HKin non Caucasian populations as well as in pre diabetic and diabetic populations although the confounding effects of treatment might obscure any role of these polymorphisms in the diabetic population  ,hypothesis
We used a strict significance level  p     and the results did not change significantly after adjustment for potential confounders which reduces the possibility of chance findings  ,hypothesis
No significant associations were found between PCB and p p DDE exposure and numbers  percentages of lymphocyte subsets after adjustment for potential confounders  ,hypothesis
Hypothesis Dstates that there is random clearance of RBCs until they reach their maximum lifespan  about days  at which they are immediately cleared  ,hypothesis
We approached this problem by hypothesizing that although a large number of interactions might be present in any given system only a small subset is responsible for its robust regulatory behavior  ,hypothesis
X   or Z   linked recessive deleterious mutations will therefore be unconditionally expressed in the heterogametic sex and cause an overall higher mortality rate  ,hypothesis
The fact that there is no striking bias in the biological functions of the genes involved in gene fusion or fission suggests that the recombinational events are basically random  ,hypothesis
Accordingly the influence of impaired LV relaxation has presumably minimally altered mitral E wave maximal velocity thus offsetting the potential additional value of combining this conventional Doppler parameter to a preload independent Doppler index that better reflects LV diastolic properties    ,hypothesis
Systematic reviews of the literature on fluoridation prove its beneficial and safe effects on human health   and its impact on the reduction of tooth decay owing to fluoridation has been observed in Brazil and in other regions in the world    ,hypothesis
The hypothesis that PF LTD implements motor learning dates back to Marr and Albus s theoretical work  Albus   Marr  published long before Ito and collaborators found experimental evidence for the existence of LTD  Ito et al    ,hypothesis
The original assumption of this model suggests that violence is transmitted intergenerationally   hence a childhood history of physical maltreatment predisposes the survivor to be a perpetrator of violence as an adult resulting in a continuing cycle of violence and abuse  ,hypothesis
According to the so called hygiene hypothesis   modern living conditions in the industrialised nations isolate infants and children from many infectious challenges that are required for the development of appropriate immunoregulatory networks  ,hypothesis
In this study   HCH has been chosen as a prototype of this class of environmental pollutants for the purpose of testing our hypothesis that they act as breast cancer promoters though their action to stimulate c Neu kinase activity  ,hypothesis
For this reason the authors suggest that any myelination seen in vivo after OEC transplantation was solely due to contaminating Schwann cells    ,hypothesis
It has been proposed that ncRNAs may form secondary structures that are more stable than would be expected from non ncRNA sequences of the same nucleotide or dinucleotide composition    ,hypothesis
It is believed that microbial solubilization of phosphate in soil was correlated with the ability of microbes in producing selected organic acids and or extracellular polysaccharides    ,hypothesis
In organisms that retain DNA methylation including plants most animals and some fungi it has been speculated that DNA methylation provides genomic immunity against mobile elements    ,hypothesis
Therefore this agent should in theory also be useful to decrease glucose requirements and the number of hypoglycaemic episodes in patients with SUA induced hypoglycaemia   effects that are related to the hyperstimulation of endogenous insulin production  ,hypothesis
Several studies in the past have reported that the hyphal form of C  albicans is more invasive compared with budding yeast    ,hypothesis
More recent studies have indicated however that carbon dioxide also makes a significant contribution to the tumor acidity which strongly implies to the importance of CA activity in oncogenesis  ,hypothesis
We therefore expect that different patterns of genetic variation are associated with regulation of height growth at different stages specifically at the two stages of fast growth  infancy and puberty  ,hypothesis
