In order to explore the plasticity of the Mic PCCgenome further the number of CDSs with an atypical dinucleotide composition was determined using a one order Markov chain based methodology    ,method
Detection of unknown variants in heterozygous samples depends upon fluorimetric analysis of signal intensity based on the principle that homozygous samples generate twice the amount of signal  ,method
Detection of unknown variants in heterozygous samples depends upon fluorimetric analysis of signal intensity based on the principle that homozygous samples generate twice the amount of signal  ,method
Most interestingly extension temperatures of degrees C during amplification using the thermolabile DNA polymerases Sequenase  Sequenase  and        exonuclease deficient Klenow fragment greatly decreased the production of frameshift products  ,method
In summary this analysis confirms the relevance of several aspects of gene expression control and genetic linkage as predictors of synteny conservation in yeast  ,method
Such a technique which makes use of high fluence ultrashort pulses of light that can precisely ablate tissue   has been demonstrated to work with vessels in superficial cortical layers    ,method
Resolution of this system yields  i j the expected frequency of dinucleotides under this Markov chain  ,method
Because stem cells are targeted by the amniotic fluid in utero delivery method the specific inhibition of C MYC in a relative small population of cells     has a highly significant effect on the histology of the rapidly developing lungs and intestines  ,method
Otherwise meaningful results have been obtained by studying distribution patterns in flattened D cell nuclei    ,method
These include neutral loss scanning for the loss of the Da phosphoric acid moiety which is lost from phosphoserine and phosphothreonine during CID in ion trap mass spectrometers  ,method
Although the yNupand vNuphave limited sequence similarity the presence of the two proteins in similar complexes suggests that they and their associated proteins form a conserved subcomplex within the NPC  ,method
Helden et al    propose a method for dyad analysis which exhaustively counts the number of occurrences of each possible pair of patterns in the sequences and then assesses their statistical significance  ,method
Where PBin  N NN is the binomial probability function  ,method
For that purpose an improved method for making subtracted cDNA libraries using uracil DNA glycosylase has been developed  ,method
So far most in situ studies of gene positioning and changes in higher order chromatin architecture have been carried out using FISH  ,method
First changes over time in nonparametric estimates of the effective population size of N  taihuensis were evaluated with the skyline plots   using R      ,method
Matthew Dimmic  University of Copenhagen Denmark  introduced a Bayesian phylogenetic approach for the detection of coevolving amino acid residues in protein families  ,method
The PCR step converts hairpins into double stranded DNAs that contain head to head cDNA fragments that can be cloned into a vector downstream of a Pol III promoter  ,method
We have developed a simple and highly reproducible IM protocol based on EpCAM antigen recognition    ,method
Thus instead of studying changes in a single community over time successional habitats of known ages that can be arranged on a temporal gradient are compared  ,method
Joel Bader  Johns Hopkins University Baltimore USA  presented a method for delineating genome wide networks based on graph diffusion kernels or clustering  segmentation  ,method
Best known is the Monte Carlo method described among others by Roggan et al     ,method
In contrast the conceptual framework presented here specifically employs proxy measures to develop a systematic measurable objective method for evaluating Internet health information quality  ,method
In this work we have developed a theoretical approach to estimate allele frequency in pooled DNA samples based on the physical principles of DNA immobilization and hybridization on solid surface using the Langmuir kinetic model and quantitative analysis of the allelic signals  ,method
It was found that high percentage of identified interactions shares GO Biological Process annotations   PPERCENT for a interaction enriched gene set and  PPERCENT for a larger cyclically expressed gene set   ,method
A frequently used solution of this problem is to simplify the combinatorial variety by focusing on small subsets of the possible reactions and complexes  ,method
Recent advances in sequencing technology       have allowed an unprecedented look at the transcriptome using a method known as RNA Seq    ,method
Cardiac output preload afterload and contractility are measured or derived from the esophageal Doppler waveform  ,method
To take into account the correlated nature of twin data we used adjusted Pearson F statistics and Wald tests for clustered data to compare bipolar with healthy twins    ,method
Detailed information of the confirmed protein characterization are elaborated in Table with respect to the precursor mass m  z error  ppm  PEAKS and SPIDER score for confidence interval  PPERCENT  for the PEAKS de novo generated peptide sequences and their corresponding homology searches  ,method
The detailed information of the confirmed protein characterization are elaborated in Table with respect to the precursor mass m  z error  ppm  PEAKS and SPIDER score for confidence interval  PPERCENT  for the PEAKS de novo generated peptide sequences and their corresponding homology searches  ,method
To investigate the functional relationship between individual modules and stress response we used the singular value decomposition method as developed by Alter et al    and applied by Oldham et al  and Horvath et al     ,method
The uniqueness of the designed primers pairs was verified using the UCSC in silico PCR search in the UCSC Genome Browser Database    ,method
For comparison with previous studies in humans   and mice   we also used antibodies targeting chemically modified citrulline  ,method
To appreciate the many changes in shape and in the actin cytoskeleton that take place simultaneously even within a relatively small area of the cell surface and within short time spans time lapse recording of live cells is necessary  ,method
There are at least four different ways to calculate protein identity   of which the mechanism used in this work was the one based on the length of the shortest sequence  ,method
The National Primary Care Development Team is measuring access as part of the adoption of the system of  Advanced Access  a system developed in the USA   as a response to patient waiting times of   weeks for routine appointments in primary care    ,method
Operons of mycobacterial genomes were predicted using methods described by Alm et al     ,method
A rapid high throughput method for kdr screening was developed that is appropriate for use in laboratories in malaria endemic countries  ,method
One alternative method which has been recommended for country wide prevalence estimates is the Multiple Indicator Method  MIM     ,method
Double stranded cDNA was synthesized from total RNA isolated from nerve cord tissue of L  kohalensis using the Creator  SMART  system developed by Clontech BD Bioscience  Mountain View CA   ,method
We describe a new method for identifying outliers when fitting data with nonlinear regression  ,method
We have developed a feature selection method named Supervised Recursive Feature Addition  SRFA   ,method
It not only allows for the selection of genomic information but helps to identify the optimal subset of SNPs necessary for finding the variations associated with disease  ,method
It uses a simple grid based method and separates the probe size used to define voids from the probe size used to define channels to the surface  ,method
Jan Vijg  University of Texas Health Science Center USA  illustrated the utility of one such technique   two dimensional gene scanning  TDGS   ,method
We estimated the recombination rate at each TE insertion site method using a method previously developed for the D  melanogaster genome    ,method
We recently developed a method to quantify residual invasive cancer after preoperative chemotherapy on a continuous scale  ,method
Based on the ECD coordinates and orientations obtained in the control condition the method of source space projection was applied to the averaged magnetic field of each condition  ,method
The bicinchoninic acid  BCA  assay is a biochemical assay for determining the total level of protein in a solution using colorimetric techniques    ,method
In this system which we named iKO the target gene can be turned on and off at will by treating the mice with doxycycline  ,method
The increase in MKDT with the amount of insecticide washed out was followed by chemical analysis  ,method
The results of amplification were analyzed by the comparative threshold cycle method also known as the   Ct method    ,method
gap or gapPC  Tibshirani et al     ,method
We used the  fossil cross validation  method to measure the agreement between these different calibration points    ,method
We used the approach of Machado et al    to distinguish between ongoing gene flow and recent divergence among the Cameroon populations  ,method
A recently developed branch support measure the approximate Likelihood Ratio Test  aLRT  can also be used to assess the support for branches    ,method
The CLR test   uses the spatial distribution of mutation frequencies in a genomic region and levels of variability among a population sample of DNA sequences to test for evidence of a selective sweep  ,method
WBP is the most commonly used algorithm for reconstruction in ET  ,method
The method is available in the limma software package which is implemented in the R software environment  ,method
Using DF SNPs potential biomarkers could be quickly identified based on SNPs SNP types or SNP patterns  ,method
Wavelet decomposition separates the low resolution information called  approximation  from the high resolution information called  details   ,method
Both linear and non linear methods of assessment of QT dynamics have been described  ,method
Furthermore each event was checked using a second method in the RDP package SISCAN  SSC     ,method
Thirteen transcripts met this selection criterion   six were further tested by quantitative RT PCR analysis of additional samples from this trial and a second SUPhase III trial of similar design  ,method
Antidromic action potentials were initially evoked by single pulse stimulation  pulse duration   ms  of the VR L or VR L CP nerve and the TA muscle nerve  ,method
RTqPCR was also used to measure the expression of CDKNA CYPACYPBHISTHD and IERin BeP treated MCF and HepGcells  ,method
For seven subjects the first peak was followed by a prominent second peak   two of these subjects had a secondary isolated peak  near k    sec  and for five of these subjects a higher frequency component appeared at k   sec  e g  subject   ,method
Finally researchers in at least studies measured drug use by inspecting medication containers at the home of the respondent    ,method
A novel computational method was developed that uses the age information implicit in the patterns of TE insertions to determine the relative chronological age of TEs in the human and other genomes spanning over million years independent of sequence divergence and the molecular clock  ,method
In addition to the collection of MIPS protein complexes we have also used the same evaluation metric adopted in   called geometric similarity index  ,method
The Pedigree Disequilibrium Test  Martin et al   allows us to evaluate evidence of LD in general pedigree data  ,method
Therefore to evaluate the performance of various methods we used a different method pioneered by Nye and colleagues    ,method
In this case it seems appropriate to apply a best interests standard in which the burdens and benefits of LST are weighed  ,method
Another alignment algorithm assumes no knowledge of peaks in common    ,method
The  Markov chain discrimination   MCD  method is our implementation of the  PFRSampler  algorithm of Grad et al     ,method
Qualitative content analysis elicits contextual meaning in context through the development of emerging themes  ,method
Stimson   originally described his  hanging arm  technique for reducing shoulder dislocations  ,method
The first and oldest method proposed by Lipman and Pearson   and described extensively by Comet et al    and others   uses Monte Carlo simulations to investigate the significance of a score s calculated from the alignment of two real sequences a and b  ,method
Among the diverse methods that have been proposed for dealing with multigene data sets is the so called supermatrix method    ,method
We propose a method called MetaViz which enables to draw a genome scale metabolic network and that also takes into account its structuration into pathways  ,method
Weighted estimating equations are an extension of the generalized estimating equations in the presence of missing visits  ,method
To determine virulence and pathogenicity of bacterial pathogens in plant microbe interactions researchers typically quantify bacterial multiplication in planta by counting the number of bacterial colonies in plate assays of leaf extracts    ,method
We propose a multiple clustering method to perform the clustering  ,method
The promoter sequences of operons encoding enzymes in the TCA cycle as expected did not appear to interact with ArcA   P  at all  ,result
As the concentration of lysoPC increases Vmax is reduced  ,result
Our experimental data therefore suggests that the overall high sequence divergence within these C terminal regions of murine ZIPK  Figure  dictates the PAR interaction  ,result
Interestingly Drice the downstream caspase activated just as individualization begins  downstream caspases are typically activated by upstream caspases such as Dronc and Dredd   was not affected by inhibition of Dronc and Dredd  ,result
In PPERCENT of the tissues analyzed higher proportions of TFs exhibit alternative splicing compared to all the genes in the mouse transcriptome  ,result
Firstly we identified yCCRmammalian orthologs and demonstrated that the human member can interact with the human yPOPhomologs  ,result
In contrast mutation of the StatE  or dAP binding motifs resulted in at least fold higher luciferase activities than obtained with the wild type promoter  ,result
Sty over expression produced no comparable change in the number of fusion competent myoblasts when compared to the control  dorsal myoblasts wild type   UAS sty   n     qualitatively similar results obtained for lateral myoblasts   ,result
These residues are also interacting with several of the residues identified without filtering  ,result
We note that EasyCluster not only reconstructed the expected single cluster but also used a much larger proportion of the input sequences  PPERCENT  while using the same filtering criteria  ,result
Her chemokine score however exhibited a significant decrease in concordance with the clinical improvement  ,result
In our time heterogeneous analysis Cephalocarida clustered as sister group to Branchiopoda  ,result
Based on this evidence we concluded that this nucleotide region of Tcawas incapable of directing translational stop codon readthrough at least in S  cerevisiae  ,result
The patient s condition worsened rapidly and she died a month later  ,result
A calibrated   l  blood smear was prepared on HDand showed a high infection with Loa loa microfilariae   microfilariae per ml of blood   ,result
At least a few colonies containing the clone of the same wheat AtVOZ like protein were found in screens with several different reporter strains  data not shown   ,result
In addition S  Aplants survived the  C treatment without previous heat acclimation  data not shown   ,result
Genetically manipulated mice that do not have melanopsin still show phase shifting by light exposure although to a lesser degree    ,result
Fst estimates recorded between A  m  bervoetsi and each of A  m  moucheti populations were very high and statistically significant  Fst    P     falling in the upper range of values reported between well separated anophelines sibling species using various molecular markers    ,result
While it has been firmly established that the onset of zygotic expression in germ cells is delayed with respect to zygotic expression in the soma our results suggest that zygotic gene expression is activated in germ cells prior to the onset of germ cell migration  Seydoux and Dunn   Van Doren et al  b   Seydoux and Strome   ,result
Our control experiments demonstrated that restriction digestion of chromosome DNAs before the electrophoresis results in release of comparable amounts of DNA from the wells in all the strains examined  Figure   ,result
In my hands only  and within a year in the hands of others  epinephrine considerably depressed the blood eosinophil count even after removal of the adrenal glands and adrenal cortex like tissue elsewhere in the body  ,result
All three of the cloned resistant alleles  two dominant and one semidominant  affect proteins that are members of G a  RGS complexes  ,result
In contrast cathepsin activity was not affected by PINdepletion  figure   ,result
However the coefficient of determination  R of the model is low indicating that the numeric influence of these factors is low despite their high significance  ,result
When washed out earlier than that only the anterior part of the NC was affected  ,result
A CGH microarray confirmed the YJBChR trisomy  Figure D   ,result
 Chemical fingerprints  of the spectrum of small molecules that bind in the presence and absence of the cofactor product  phosphoadenosine  phosphate  PAP  demonstrate a marked change in the small molecule binding profile upon PAP binding  ,result
Here we show that laminin is one component of the MTJ that stops elongating fibers  ,result
Since no selective pressure has been enforced  good  experts have in fact been counterbalanced by  bad  ones giving rise to a Q  PPERCENT  ,result
The minimum distance from roads and the frequency of croplands  ROAD and CROP predictors  had the highest coefficients for all three species  forms  ,result
is strikingly similar to the previous one  equation    i e  slope and intercept are almost unchanged  ,result
The effect is of the same order as that of SDs  ,result
Indeed when the multivariate model was adjusted for these therapies the differences in mortality disappeared and statins were significantly associated with better survival  ,result
In particular deletion of WSSwhich encodes a potential protease acting in the SUMO pathway   is synthetic lethal with deletion of SGSthe yeast RecQ homolog    ,result
These latter procedures would provide such biomechanical improvements as optimal rib cage and thoracoabdominal diaphragm motion which in turn would result in improved respiratory mechanics and improved arterial venous and lymphatic circulation throughout the body  ,result
Therefore worker patrigenes would always favor suppression of brothers  ,result
When M equals one   i e  exposure within groups is homogeneous   equation Ashows that the ecologic and individual level results are equal  ,result
As we expected no single statistic performs well for all simulation conditions  ,result
However integral and length adjusted residual stabilities increase with the absolute number of sites fitting each substitution rate categories  see Additional File   integral stability  Spearman s rank correlation coefficients rs      and    residual stability  rs       P     and   P     for MMMand Mrespectively   ,result
Although Eagis an integral membrane protein  as unequivocally demonstrated by electrophysiological measurements    we observed a strong intracellular staining that masked the cell membrane signal that was as such evident only in some cells  ,result
Despite this elevated ratio in anthropoids we note that the overall ratio is still less than one  ,result
The shorter MAOA CA alleles were found most frequently on the chromosome carrying MAOA uVNTR allele or whereas the longer MAOA CA alleles appeared most frequently on the chromosome carrying MAOA uVNTR allele  data not shown   ,result
It was suggested that maternal permRNA present in the oocyte can set the phase of permRNA rhythms in early embryos  ,result
Nevertheless an apparent obstacle to this proposal was that NOS inhibition did not correct the loss in myocardial contractility  ,result
In the SLE patients included in the study IFN score was significantly correlated with chemokine scores  Figure c  implying that expression levels of the IFN inducible chemokines are associated with those of classical IFIGs in SLE  ,result
It is observed that the initial level of muscle activation and muscle forces were not identical between these motions  Figure and   ,result
Preliminary results appear to indicate that PBMCs from RA patients taking methotrexate produced greater amounts of IFN   after successful anti TNF treatment  ,result
Concerning the other media described in this paper such as diluted Sabouraud medium in buffers with basic pH we believe that there is a decrease in the growth rate of the yeast which could trigger capsule growth possibly as a consequence of a stress response  ,result
In the present study no differences were noticed in IL   TNF alpha and IL levels of first trimester TACP with good outcome between admission and discharge  ,result
In order to develop future treatments based on regenerative medicine it may be worth noticing that the currently reported yield of AM hMSCs resulted from a very small area which is about  of the total area of amniotic membrane  ,result
We have identified a polymorphism located in MdMYBthat co segregates with the presence of red core colour in apple flesh and red foliage  ,result
Somewhat surprisingly we identified a conventional spliceosomal intron at exactly the same position and in the same phase within Rpla in many animal  opisthokont  taxa and in the amoebozoon Dictyostelium discoideum  Fig    ,result
What is perhaps surprising is that DM which uses multinary profiles that incorporate gradients of similarity performed similarly to the binary SM method  ,result
Once inside the host cells internalized A  baumannii was located in the membrane bound vacuoles  ,result
BVC values resulted significantly  p     different in comparison with vehicle treated animals at hr after administration  ,result
In control cells the amount of Chl and thylakoid membranes increased rapidly when cells were illuminated and LHCPs were detected in thylakoid membranes throughout the chloroplast  Fig  a   ,result
The results showed the homogeneity of the association between the FDepindex and all cause mortality with regard to the various degrees of urbanicity and the regions  ,result
However overexpression of G aq GS did not suppress the inhibitory effect of BMS upon carbachol stimulated calcium flux  Figure C   ,result
Unexpectedly birtoxin like peptides appeared to present a new structural motif distinct from those present in K and Na channels Toxins  ,result
Unlike mammals the zebrafish has only one hypocretin receptor  ,result
In general by expanding these datasets we increased the numbers of lineages and levels of sequence divergence  Table  to values where the LRTs are expected to have low type I error rates    ,result
Aside from the base pair deletion there were no other SNPs or sequence changes evident in the remainder of the ORF sequence of Pach n compared to Surface Mcr sequence  ,result
Therefore these are the components that lead to the superior performance of MASgcRMA and the dChip mismatch model in our initial analysis  ,result
Overexpression of functional PAI did not rescue the cytotoxic effects or OASinduction observed in cells transduced with a series of vectors for expression of different length shRNAs  ,result
From this we can estimate that doubling the number of sampled read sequences will only lead to the discovery of approximately additional taxa  ,result
Although four out of six control monkeys became positive for blood stage parasites and only two out of six developed an infection in the vaccine group the result was statistically not significant and must be interpreted that in this small trial no protection was demonstrated  ,result
No indels or premature stop codons were observed  ,result
Loss of HSPCrecapitulates all aspects of nervous system defects characterizing SCAR CYFIP and Kette mutants but notably does not lead to abnormal cell fate choices in sensory organs an Abi and WASP related function    ,result
Targeted deletion of Bhlhban Olig family bHLH factor causes the loss of gamma aminobutyric acid  GABA   producing amacrine and Type OFF cone bipolar cells  ,result
Cross platform comparisons using correlation analysis showed correlations comparable to other cross platform comparison studies    ,result
Our RT PCR experiments also show MNDand HOPexpression in cyclical and obligate parthenogens but MNDwas also expressed in males and in female soma  ,result
The dentate gyrus unlike the phenotype in the adult also appeared chaotic suggesting a delay in its development  ,result
Strikingly the loss of gro function suppresses the inhibitory effect of Him  Figures H J  showing that Him requires gro to inhibit muscle differentiation  ,result
We found that the free energy difference between the open and closed states of the MscL channel changed from  kBT to kBT when single component bilayers in ld phase were compared with raft mixtures  ,result
In the current study we demonstrated that inactivation of  selectively in forebrain neurons after  weeks of postnatal life also resulted in reduced sensitivity to the sedative  hypnotic response to etomidate  ,result
