In Case few spindled cells embedded in stroma showed focal cytoplasmic positivity  ,finding
Fifty eight percent met the  adherence  criterion of PPERCENT sessions completed  ,finding
The use of micronutrients   PPERCENT  was excluded from TCAM since mostly vitamins were provided by the health facility  ,finding
Interestingly in vitro generated CD T cells specific to BCR ABL immunogenic peptides were shown to proliferate and produce Thcytokines in response to HLA matched CML blasts in absence of exogenous antigen presenting cells    ,finding
The DD cohort also used significantly more of all classes of pain medications than the DM cohort and significantly more antidepressants than the DN cohort  ,finding
Quantitative assessment of ATBFA mRNA expression according to LOH status at the ATBFA locus demonstrated no relationship between these factors  ,finding
The geometries of both the pyrazolopyrimidine C phenyl bond and orientation within the binding clefts are conserved within the two complexes  ,finding
Our results on transmission risks for HB show that within the German population little knowledge exists about the fact that HB is transmitted sexually  ,finding
Rather it appears as if L  gasseri and L  iners offer poorer colonisation resistance thereby allowing the overgrowth of other bacteria  ,finding
Interestingly inhibition of pwith SBresulted in enhanced JNK phosphorylation  ,finding
Participants also had unrealistic expectations about what they could achieve through dieting alone in many cases turning to the diets or interventions such as obesity surgery which they perceived would lead to the greatest weight loss in the least amount of time  ,finding
The nonconformists felt things like their future health were not within their control   their coping strategy was one of denial  ,finding
The observation that over PPERCENT of avian E  coli isolates were resistant to nalidixic acid  concomitant with reduced susceptibilities to the fluoroquinolones  is important considering that the fluoroquinolones are used to treat a range of E  coli infections in humans    ,finding
Urbanization was linked to a higher prevalence of somatoform disorders among people with lower SES  ,finding
Phylogenetic reconstruction identifies the duplicons located in the pericentromeric regions of human chromosome and human and chimpanzee chromosomes and Y as the most recent ones in the respective genomes  ,finding
Geographic races and species that coexist in sympatry therefore form part of a continuum in terms of hybridization rates or probability of gene flow  ,finding
Named heliconiine species remain useful for predicting significant differences in morphological ecological behavioural and genetic characteristics even though they regularly hybridize and exchange genes  ,finding
However in a study on anticoagulation with low molecular weight heparins during CVVH we did not find a relationship between anti Xa activity and circuit survival time  with a maximum anti Xa activity of     U  mL gradually declining over the span of hours a circuit survival time of     hours was reached    ,finding
Nevertheless when the rabbit was then subcutaneously injected with an aqueous extract of jaborandi a marked decrease of the frequency of its heartbeats  from per minute to per minute  occurred within ten minutes  ,finding
We found that on average match rate and census tract concordance were much higher and mean   much lower in analyses of the edited versus unedited versions of the database  ,finding
The alignment  Fig  B  of the obtained RT PCR product sequences with DBand with representative Group subgroup B ESTs  BMand BP confirmed the co linearity of these transcribed sequences  ,finding
All MGsequences obtained contained a constant region of bp in the  end and of bp in the  end which were identical to the corresponding region of the GT MGgene  ,finding
In addition the derived NPs had decreased levels of pluripotent markers Octand Nanog but had levels of Soxthat were comparable to hCNS SCns  ,finding
In our study we showed that SNPwas significantly associated with hypertriglyceridemia especially in type diabetic patients  ,finding
The deletion of the PPTmotif alone or a deletion of both PPTand PPTreduced EGFP expression below the detection limit  ,finding
As shown in Fig  when IFNa induced increase of ERK activation in Ucells was efficiently inhibited by treatment of PDthe specific inhibitor of the upstream kinase of ERK MAPK  ERK kinase  MEK  in the Ras  MAPK pathway IFNa mediated growth stimulation effect was also decreased at the same conditions  ,finding
PET seemed to be prescribed when physicians considered a higher probability of malignancy of the nodule  spiculated  or to identify distal metastases  ,finding
The juvenile patient presented with developmental delay apparent sex reversal and entirely parthenogenetic blood leukocytes  ,finding
In the present study LYwas also shown to strongly inhibit MMP and MMP production by unstimulated and ET stimulated OA chondrocytes showing the key role of cGMP for the synthesis of these enzymes  ,finding
We could however detect a difference in distribution of genotypes in HCV positive and healthy individuals  ,finding
A transient reafferentation as indicated by the delta reduction will then not suffice to fully break up the maladaptive oscillatory pattern  ,finding
Notably with only one exception  cluster   all the RING domain clusters only contain members from the same respective class of metal ligand arrangement   that is prototypical RING HC domains are only found in clusters with other RING HC domains  ,finding
Indeed with regard to our E  coli proteins yields of most target proteins improved when fused to MBP His Table   ,finding
The persistence of some zygotene and intact pachytene oocytes between and dpc without indications of apoptosis has not previously been reported  ,finding
Although some recent studies   suggested a unique sex specific role of ACE in essential hypertension no significant association of essential hypertension with the ACE gene I  D polymorphism was observed in this German population of  for either gender  ,finding
In the presence of rifampicin and cephalexin relA mutants assumed integer DNA content similar to wild type cells but with slightly more N relative to N peaks  ,finding
anti HCV had an overall prevalence rate of  PPERCENT with no significant differences between sexes  males   PPERCENT females   PPERCENT  increasing with age and peaking in the years age group for males and in the years age group for females  ,finding
In contrast the heart failure group had a higher   and lower potential power at end ejection but similar   and d  ,finding
The results in this study indicate that BED and BS are common behavior among overweight individuals with schizophrenia undergoing antipsychotic drug treatment  ,finding
When considered in light of the results of Yang et al   our data suggest that neither Gossypium genome is globally dominant with respect to expression but that instead each genome may have local dominance in certain tissue types or developmental stages  ,finding
On September a large percentage of these patients were still waiting to go back home or to a nursing home  ,finding
Picrotoxin potentiated the evoked presynaptic excitation  ,finding
In both children and adults with asthma filling at least one prescription was even more common than making an office visit suggesting that several people received all prescriptions from a site other than the office  ,finding
Furthermore it is notable that blood pressure lowering with the two doses of ramipril used in the SECURE trial did not parallel the effects on atherosclerosis  ,finding
We also sequenced DNA of both parents and the father carried the AT mutation only whereas the splice site mutation was present in the mother  ,finding
In addition confinement in a vehicle has been shown to cause a significant increase in   endorphin and ACTH concentrations    ,finding
The procedure was repeated for several conditions always with the same result  ,finding
In particular apolar and aromatic amino acids as well as the backbone have pronounced contact preferences for urea whereas charged amino acids have preferences for water contact  ,finding
It appears from our subsidiary analysis that at least some of the key differences between our supertree and the original LEA study lie with the selection of independent source trees and in the avoidance of a priori assumptions of monophyly  ,finding
Normal breast samples of Australian postmenopausal women have been included in the ER a study   the result showed a strong correlation  r    between ER a expression in normal breast epithelial cells and body mass index  BMI  in normal women who currently use HRT  ,finding
As expected the levels of Hymenoptaecin mRNA which are either very low or undetectable in control bees were dramatically induced    fold  in those individuals that were injected with E coli but not in those injected with yeast  bees No  and   ,finding
Concerning group III the results of IHC indicated some virus replication between PIDs and in the tonsils and in the lymph nodes but similarly to VI only in three animals  ,finding
Cells from heterozygous patients PPand Pshowed no impairment of the induction of STATdependent target genes in response to IFNG and IFNA  ,finding
Consonant with the other research findings   our study shows that quantitative workload was a significant predictor for WIF  ,finding
Even though mean Hb was comparable in both ways of administration in our study mean EPO dose was significantly lower for subcutaneous than intravenous administration  ,finding
All of the black GALT alleles examined in our study carried the SL amino acid substitution  ,finding
The observation that pioglitazone reduces glia activation indicates that orally administered pioglitazone like ibuprofen can traverse the blood brain barrier and exert anti inflammatory actions in brain  ,finding
More over the higher number of uninfected surviving females  and males evidently  induce a positive feedback on the founding of uninfected populations which on their turn have overall low chances to be colonized by infected females eventually leading to the curing of the entire metapopulation  ,finding
Relative to non metastatic NMCcells DRIM expression was  fold lower  PPERCENT of NMC in metastatic MAcells  Table   ,finding
Bacterial concentrations were consistently higher in the wound fluid than in the wound tissue and strains found in the fluid sometimes differed from the strains found in the tissue  data not shown   ,finding
We did not find any change in plasma levels of the FXIIa Cinhibitor complex and the kallikrein Cinhibitor complex making initiation of coagulation via this pathway less likely  ,finding
In comparison AQ performs substantially better with a day rate of APCR of percent as observed in this study  ,finding
Quantitative analysis revealed that the number of  m and   m particles inside MDM was twice the number found in MDDC  ,finding
Laminin clearly induces microaggregation of receptors after hours in our culture system  Figure   ,finding
For hookworms the phylogenetic analysis using BI indicated a closer relationship between Ancylostoma spp  and Necator americanus than between either of them and Bunostomum phlebotomum  ,finding
However in several subjects the circulating life and efficacy of PEG uricase was foreshortened by the induction of antibodies against PEG uricase which unexpectedly were specific for PEG rather than for the uricase protein  ,finding
In primary hippocampal cultures mouse  N is enriched at the discrete sites of synaptic contact colocalizing with the postsynaptic density protein of kDa  a postsynaptic marker  and glutamate receptor type  an excitatory postsynaptic marker    Previously  N has been shown to associate with the membrane proximal region of GluRin vivo and colocalize with AMPA receptors at excitatory synapses where it might implicate in AMPA receptors clustering and connecting to the actin cytoskeleton   Conceivably protein  N may function to confer stability and plasticity to the neuronal membrane via interactions with multiple binding partners including the spectrin actin based cytoskeleton integral membrane channels and receptors and postsynaptic protein like PIKE L  ,finding
Persons with primary education were at a greater risk of injuries than those with no formal education  ,finding
In this study an antibiotic sensitivity could not be observed after prolonged growth in the absence of antibiotic pressure during cultivation indicating that ISgenerates cointegrations that are stably maintained in C  glutamicum  ,finding
GCTs express CDconstantly  ,finding
In the present review we discuss recent evidence that the unifying molecular defect in TRAPS associated mutant TNFRis receptor misfolding and retention in the endoplasmic reticulum  ER   ,finding
The not significant effect caused by the treatment with NI or LTG alone on MDA parameters could be due to the significant number of animals which were not responsive to the AB stimulation  ,finding
For the Forger and Peskin model an increased rate of primary Perphosphorylation predicts a shortened period  ,finding
Using this limited dataset and a variety of sophisticated counting procedures we were not able to establish a statistically significant correlation between the positions of protein interaction sites and alternatively spliced regions  ,finding
On the contrary they indicate that binding determinants of the SET  TAF I   Hinteraction lie within the globular domain of H ,finding
Our study indicates that the age adjusted rate of sepsis mortality exhibited a very slight downward trend decreasing by  PPERCENT per year from to  ,finding
Theta band activity increased over the left hemisphere after MPH application  ,finding
Interestingly beyond the differences in relative laminar thickness there were also marked differences in absolute cortical thickness between sulcal and gyral regions  Figure S  ,finding
However when we compare the diversity and divergence patterns based on the intergenic probe expression among the three tissues we find that the brain shows less divergence than the other two organs  Figure A  while testis shows a greater divergence to diversity ratio  Figure B  to an extent comparable with the results for exonic probes  ,finding
However an individual s propensity to prefer a society with improved life expectancy for the worst off is mitigated by the cost of reducing life expectancy for the better off  ,finding
Interestingly enough the levels were increased in the case of Alzheimers type dementia cerebral infarction and CNS infection  ,finding
Positioning the backpack high on the spine produced largest postural response at all anatomical points  ,finding
Of significant biological interest is the conclusion from the adjusted analysis that the mode of regeneration has no significant effect on the balance between sequence and methylation state change induced by the tissue culture process  ,finding
These two materials are visually indistinguishable but are clearly differentiable on the basis of the compounds observed in their pyrolysates  ,finding
The presented study shows that individually dispensable C  elegans putative aminophospholipid translocase genes exhibit a high degree of specialization  ,finding
In the present study Theta band activity increased left hemispherically after MPH application  ,finding
Tsuchiya and colleagues have reported that the Japan scheme yielded consistently higher scores than the UK weights except for the very mild states    ,finding
Combined these studies yield a non significant reduction g     PPERCENT CI       of salivary cortisol for the participants receiving MT in comparison to controls  ,finding
We did not find activity effects on half time to recovery  ,finding
The differential enhanced odor response between observers and demonstrators despite similar net enhancements relative to controls suggests the presence of a stress effect from the infusion technique  ,finding
They found that the sum score was predictive for physical and verbal aggressive infractions  ,finding
However we found no prognostic significance of pre treatment hemoglobin values  p      ,finding
We demonstrate for the first time that comparable levels of postoperative analgesia can be achieved with  g of IT morphine  ,finding
During cervical cancer progression a subset of tumors express the apoptotic protein Smac de novo  ,finding
We conclude that replication timing correlates with annotated chromatin marks that reflect transcription but not repression  ,finding
A lack of homozygosity of the shared epitope in GCA has been reported in northwestern Spain   and Rochester Minnesota    ,finding
The sole exception was the presence of non urticarial rash which was more common in patients with SLE than in the comparison group  ,finding
In this study we observed that a high proportion of infiltrative lobular carcinoma cases  PPERCENT  showed nuclear immunostaining for ER a   the percentage was similar for infiltrative ductal carcinomas   PPERCENT   ,finding
We were unable to find a role for coding variants of the BTC gene in either TDM risk in African Americans or in altered   cell function in glucose tolerant African American individuals  ,finding
The eight regions deriving from the eight AB descendants of the cell stage embryo   are also elongated  ,finding
In one BR RTX concentration was increased to  M RTX  Figure left  a level that is more than times higher than the expected EDwithout  nonspecific  effects on pressure discharge relations  ,finding
Our study also showed that the proportion of Asian American HCC patients with previous HBV did not decrease over time  ,finding
In conclusion we found that the concentration of pro atherogenic chylomicra and postprandial chylomicron response was not influenced by a single session of moderate intensity exercise  ,finding
They suggest that the Peffect might index an attentional facilitation of early sensory processing while the Neffect may index exogenous orienting of attention possibly representing activity of frontal and parietal components involved in eliciting attention changes  ,finding
Timperio et al    found that adolescents who had a more direct route to school were actually less likely to report walking or cycling suggesting a disconnected environment may represent a safer one for walking or cycling as a mode of transport  ,finding
We replicated this in the context of smoking behaviour  ,finding
However in the experiment in which iron sucrose and HF membranes were run at UFR significant amount of iron   PPERCENT     were lost from the SBS reservoir at minutes  Table     ,finding
The inverse relationship between BMP  E cadherin and dEFwere validated in breast cancer specimens using quantitative RT PCR  ,finding
These results show that necrotic neurons activate in microglia a MyDdependent pathway responsible for a pro inflammatory response that also leads to increased neurotoxic activity through induction of glutaminase  ,finding
In the present study children who exhibited weaker WM executive control were thought to have weaker ability resisting interference which manifested as inattentive behaviour as viewed by their caregivers  ,finding
Thus specific cytokine alterations are particularly important among patients otherwise predisposed to related adverse outcomes  ,finding
Expression of ATPB another transport protein previously reported to be involved in cisplatin efflux was comparable in sensitive and resistant cells  ,finding
In a rat model of acid induced acute lung injury Frank and colleagues   found that ventilation with ml  kg resulted in less alveolar flooding and less alveolar epithelial injury as measured by plasma levels of a type I cell specific marker of injury  RTI compared with ml  kg and a similar level of PEEP  ,finding
From the top signal behavior covariates for proliferation and migration in our model  Figure B  HER Yappears to be the main upstream activator of migration whereas proliferation seems to be activated by EGFR Yand to a lesser extent EGFR Y ,finding
The timing of intervention became important as he showed treatment of hydrocephalus at week largely prevented the damage while shunting at weeks failed to restore the injured white matter concluding that hydrocephalus in the immature rat brain delays myelination but compensatory myelination is possible if treatment is instituted prior to the development of axonal injury    ,finding
For instance we see that promoters of genes bound by the repressor Umeare significantly hypo acetylated at most positions  ,finding
Together these data strongly suggest a role for IL in human IBD  ,finding
Two bands of kDa and kDa were particularly intense in the dayculture of volunteer  Figure A   ,finding
No class of genes  e g  outer membrane proteins  could be identified that showed more SNPs than the average  data not shown   ,finding
Residues and possess the five highest mean connectivity values   see Panel A  ,finding
The lateralization of the response cueing effect suggests that the processes related to response inhibition have been right lateralized in the present study  ,finding
Corresponding to better knowledge among the young age was inversely associated with vaccination status   the older participants were the less likely they were to be vaccinated  ,finding
However mERhigh cells responded to a much wider range of Econcentrations  to mol  l  with a declining  but still significant  ERK activation at nmol  l E ,finding
In the French speaking community they seem to prefer to prolong life for longer continuing available treatments  including the use of sedative drugs  and to intervene later in the dying process using less direct ways  ,finding
These effects of hormone priming on systemic relaxin levels were reflected in the statistically greater fold increase of relaxin in   estradiol  relaxin versus progesterone  relaxin groups  p      Figure a   ,finding
Comparison of the expression maps of serovars Typhimurium and Pullorum revealed that despite the similarities in the expression patterns there was a high degree of variation amongst clinical and laboratory isolates even when they were from the same serovar  ,finding
Negatively correlated transcripts are overrepresented in the very  end of relative probe positions whereas positively correlated transcripts have a shift in relative probe positions towards the  end direction  ,finding
Thirty eight per cent of the women with nonlocalized tumors who had a recent pregnancy died within years of diagnosis as compared with PPERCENT of the women who had not had a recent pregnancy  ,finding
In addition we demonstrated in the discovery dataset that the families that contributed to the association of SNP rswith AD also accounted for most of the linkage signal  ,finding
Both caerulein and PYLa peptides may be secreted from skin glands and exert antimicrobial activities  ,finding
While the specificity of mosquito malaria interactions at the species level is well documented   the present results are the first experimental evidence of the genetic specificity of mosquito infection by malaria parasites at the intraspecific level  ,finding
We have used stylectomy to access the phloem sap of a number of crop plants  barley pea potato tobacco turnip  and AsA was detected without exception  ,finding
The study concluded that the increased liking of sour was caused by a response in S fibers not by a suppression of the response to sour compounds in H fibers    ,finding
If cell division is inhibited twist is not expressed and the mesoderm derived from this cell is never generated  ,finding
Hence for all three definitions we observed a pronounced but not absolute prevalence of PPII configuration in the denatured ensemble  ,finding
The most notable brain areas with high intensity of the density function are shown in Table  ,finding
Information regarding the originally presented shape is no longer present  ,finding
Importantly for the eight patients whose tumors did not present RARB methylation the paired cell washing sediments DNA were also negative for methylation  ,finding
It is interesting to note that two major enzymes responsible for proteoglycan degradation were stimulated by gal  ,finding
In this study only a moderate association between PCL R scores and prison misconduct was observed  ,finding
With this design we found that persons who drink more often were less likely to be obese  ,finding
The high levels of both of these calcium storage proteins in the sarcoplasmic reticulum may modify calcium release and subsequently lead to reduced cell contractility decreasing the percentage shortening by PPERCENT  ,finding
The results from our detailed comparative analysis are indeed most consistent with the presence of a co evolutionary arms race in simultaneous hermaphrodites which has generated a diversity of dart shapes and reproductive organ morphologies  ,finding
If a woman s life is considered less valuable than a man s it is likely that when she is ill she will be given or allowed access to fewer care  treatment opportunities  ,finding
The present investigation has revealed differential response of enzymes in response to aluminum insult in various regions of the brain  ,finding
The ability to decrease IFN   production characteristic of the potent suppressive effect of MPCs on T cell proliferation is present but less pronounced for T MPCs compared with BM MPCs  ,finding
The comparison of pain intensity between the dexamethasone diclofenac K group and diclofenac K group showed significant difference between the two groups  P     indicating an enhanced analgesic effect of diclofenac K when administered in combination with dexamethasone  ,finding
