The ChIP experiment of Figure E in which FLAG tagged HB was probed supports the conclusion that the bp regions between HS sites in Figure are occupied by nucleosomes   ,experiment
Moreover ablating one of the two putative Polo binding sites on Mtrm by mutation prevents the physical interaction between Polo and Mtrm and renders the mutated Mtrm protein functionless   ,experiment
Athymic nude mice were maintained under the same conditions in a germ free environment   ,experiment
Plasmids DNAs were prepared from these orange colonies and subjected to Pst I Sph I Bam HI digestion   ,experiment
Therefore for the calendar year of he and a colleague from his arctic explorations ate a diet consisting of meat and fat for months   ,experiment
These artificially generated conditioned fear memories were not transient   they lasted at least days indicating that mice will condition as readily to ACC stimulation as they might to shock delivery   ,experiment
The deletion abolished silencing at the HMR locus to the same extent as did deletion of the SIRgene  Figure    ,experiment
Remarkably despite undetectable levels of sequence identity TrpF and HisA that catalyze the Amadori rearrangements can be interconverted by directed evolution  starting with TrpF a single point mutation at the end of the fifth   strand was found to confer the ability to catalyze the HisA reaction while retaining the TrpF reaction     ,experiment
We chose the pair of phenotypes MXDRNK and ttth one of the electrophysiological measures  as the bivariate phenotype to perform the main simulation of linkage with unlinked markers in which we ran  replicates   ,experiment
For these baseline environmental preference measurements juvenile mice from the A BALB Band DBA strains were examined  N  mice from seven to eight litters per strain    ,experiment
Following the conditioning protocol of Experiment a total of mixed BALB  Bsocial groups were examined  N  mice from litters per strain    ,experiment
Furthermore each participant was required to perform the same game twice to trace long term participant preferences after the completion of first trials in the modified IGT   ,experiment
ProtocolSubjects GroupMaleFemaleAgeUE FMEP Joysticks  Able BodiedN  AStroke Induced Arm ImpairmentLow    High    EP TheraDrive  Stroke Induced Arm ImpairmentLow    High    EP Posture Study  Able BodiedN  AUE FM   Upper Extremity Fugl Meyer   ,experiment
Full text papers for these samples were subjected to a  pseudo curation  procedure in which the paper was read by an expert and instead of being fully curated was only scored with respect to its  curatability  for containing a TFBS  see Materials and methods    ,experiment
To check whether fgfexpression was actually silenced in the transformed cells immunohistochemistry with an antibody to GFP was performed on whole mount embryos and on sections after fgfin situ hybridization   ,experiment
The dose dependent transcriptional responses probably directly reflect the dose of bacteria in the tissue and also due to the lag phase in bacterial growth different durations of inflammation in the tissue   ,experiment
The resulting nonlinear steady state response curves provided an estimate of the true f null cline  henceforth referred to as fL    ,experiment
Because catenanes were seen under conditions where either bla was fully functioning  pREC  or impaired  pKNOT  it does not seem likely that catenanes block replication and transcription  or cause mutagenesis    ,experiment
We suspect that   globin mRNA was in excess of the probe level used in these experiments and tested this assumption by using a large excess of probe to analyze   globin mRNA by northern blot  Figure B    ,experiment
The recombinant virus not only predisposed these mice to gliomas but MoMuLV also efficiently tagged oncogenes in the brain potentially collaborating with PDGF     ,experiment
Therefore the hypothesis of a global change of conformation of poly  CA    poly  TG  induced or stabilized by supercoiling had to be ruled out   ,experiment
We further verified this by in vitro transcription  translation with the plasmid constructs followed by reporter gene expression analysis  Fig     ,experiment
Hence our experimental design for providing a definitive test of the fate of prospective endoderm and mesoderm cells of the streak included transplanting the more caudal rostral streak cells which contains prospective endoderm cells not contributing to the midline floor of the foregut     ,experiment
These may be isoforms generated by alternative splicing  i e  ELP b  or proteolytic fragments of ELP a   ,experiment
EV mg  rat reduced intakes of a saccharin solution  no ethanol  but produced less reduction in intake of a sugar solution     ,experiment
Body weights of hamsters pre treated with h versus h melatonin were also lower through Week  F      d f      p       ,experiment
Entrainment parameters were assessed with two factor analysis of variance  ANOVA  with photoperiod  LD vs SD  and melatonin pre treatment duration  h vs h  as independent factors  Statview    SAS Institute Cary NC    ,experiment
Correlation coefficients r routinely exceed  over the range of mg     ,experiment
We conclude that barrel cortex firing rate on each trial predicts the animal s judgment of texture   ,experiment
During the Second World War another oft cited study was performed this time examining the practicality of pemmican  a mixture of dried meat and fat  as a light weight emergency ration for soldiers   ,experiment
For example it is known   that Stenull mutant cells are unable to mate or to arrest the cell cycle   ,experiment
Hence bringing these levels of speech processing together and utilizing subtle featural differences such as lip rounding in experiments that do require natural speech recognition will help to disambiguate the role of the beta ERD seen here   ,experiment
There are only few data relating the metabolic consequences of feeding diets very low in n fatty acids   ,experiment
The amount of soluble and non soluble protein for each mutant was analyzed by western blotting as shown in Figure using anti GFP for the detection   ,experiment
On the otherhand in heminested PCR assay using same annealing temperature only one single band of bp size was produced at the second PCR reaction  fig    ,experiment
Mhuman melanoma cells expressing Casedisplayed a nice high dynamic range response to ATP at a final concentration of  M  Figure e h    ,experiment
In order to ascertain whether this is the case we assessed responsiveness to LIFDex of a representative panel of cluster   genes in the presence  absence of the protein synthesis inhibitor cycloheximide  Figure E    ,experiment
Strikingly introduction of a bulge in the pri miR a stem  UC   GU  made its processing more efficient and completely independent of the presence of hnRNP A Figure C    ,experiment
Two experiments were performed on adult male house sparrows  Passer domesticus  caught around Lucknow city    N   E  and quarantined in an outdoor aviary for days   ,experiment
Nevertheless these papers do not analyze the solutions by the MI based measures as we do here   ,experiment
The percentage of metaphase chromosome spreads  n    showing HKmstaining was analysed in undifferentiated clone ES cells which expressed Xist for d  lane  or were further grown without inducer for h  lane  or h  lane    ,experiment
A recent paper reported that knocking down RGA along with its paralog RGA resulted in changes in the boundary of anterior and posterior domains of PAR proteins in the early embryo     ,experiment
We have previously shown that lack of lectin signal from IgG corresponds well to complete hydrolysis of the chitobiose core of the IgG glycan as analyzed by mass spectroscopy of hydrolyzed IgG     ,experiment
Figure F shows the merge between Nissl staining  C  GFAP immunoreactivity  D  and GluRexpression  E  in the lamina IX in the cervical region of four week old wobbler mice   ,experiment
Subsequently the RNA synthesis in this region was analysed by RT PCR in cells growing exponentially in minimal medium   ,experiment
The results obtained using a single dose of scrapie inoculum were then re evaluated using the same dose of cytokines and different doses of scrapie inocula  data not shown    ,experiment
NA cells were selected for this experiment in favour of the NIHTcells shown above due to a higher ratio of nucleus to cytoplasm   ,experiment
To analyse this further we combined the data generated from all oligos that covered the transcribed regions in order to compare the expression profiles of the sense and antisense tags over time  Figure c f    ,experiment
Consistent with the findings above KTSLPtg animals also developed B LPD only during the neonatal period which disappeared later in life despite elevated serum TSLP levels  Figure D and E    ,experiment
In a parallel staining the cells were probed with MitoTracker and merging of the pictures indicated an identical pattern   ,experiment
Pre treatment of microsomes with Proteinase K however resulted in the loss of signal for BnDGATon the Western blot  Figure lane  suggesting that the N terminal segment of the enzyme was digested by the proteinase in microsomal vesicles   ,experiment
Subcellular localization of Cx protein variants in transfected NIHTcells  Confocal laser scanning imaging of the subcellular distribution of EGFP and the Cx EGFP fusion protein constructs in NIHTcells   ,experiment
Lacking a suitable antibody for immunoprecipitation of CHOP we measured CHOP protein stability instead by immunoblot after treatment of stressed cells with the protein synthesis inhibitor cycloheximide   ,experiment
The predictable exception was a mAb that only recognizes denatured geminon blots and would not be expected to bind native complexes   ,experiment
In the complementary experiment pro Th explants do not express Shh    and only rarely the Th marker Gbx   after hours in culture  Figure c  while pro ZLI  pro Th explants express both genes in the majority of cases     Figure d    ,experiment
The spectral profile of this component is concentrated mainly in the delta range     Hz  and is unlikely to cause the modulations observed in the beta and gamma ranges   ,experiment
When we reintroduced the wild typeDatransgene into the mutantP DorP EYbackground by using OKGAL  a driver with expression in several elements of the giant fiber circuit  including the giant fiber DLMmn TTMmn and PSI  we were able to fully rescue the activation of the DLM by giant fiber stimulation  Figure B andC    ,experiment
After hours in the presence of thiamine intracellular thiamine already reached a maximum while with benfotiamine an important lag period was observed   ,experiment
In the presence of a morpholino the GFP pri miR mRNA level is higher compared to control embryos that were not injected with morpholinos   ,experiment
Experimental details and further analysis can be found in Futschik et al      ,experiment
Figure B shows that greater summed probe item similarity  left side of each pair  predicts greater probability of a Yes response  paired T test for conditions a and b showed p    for c and d p       ,experiment
We wanted to assess directly whether this species is heterotypic  i e  CenHHA HB and H or homotypic  i e  two copies each of CenHand H   ,experiment
Due to the following acquisition sequence  MART Jurkat  gpMART Jurkat  MART Control Jurkat  gpand Control Jurkat  MART  we believe that carry over of the MART Jurkat  MART tetramer sample caused background staining in Control Jurkat  gptetramer   ,experiment
We reproduced these values on the stereomicroscope and then tested the response of wild type animals to these different wavelengths at these powers   ,experiment
As expected NBI stimulated IGF dependent proteoglycan synthesis in a dose dependent manner  Fig  a  but RIGF activity which by itself was highly enhanced compared with IGF remained unaffected by NBI  Fig  b    ,experiment
PC M cells were incubated in suspension over a period of days and then assessed by flow cytometry for uPAR cell surface levels   ,experiment
Perhaps the most surprising result is the apparent systemic effect of the hormones   ,experiment
Therefore the effect of two PKC inhibitors GFX which inhibits all PKC isoforms and G which only inhibits classical isoforms on the growth inhibiting effects of vincristine on SK N BE   cells was investigated  Figure Table    ,experiment
To model the state of detachment in which cancer cells must exist during metastasis both cancer cell lines were placed in forced suspension culture and incubated in suspension over a period of days during which the numbers of early apoptotic vs  live cells were quantitatively scored   ,experiment
Our time correlated evaluation of IP secretion at different times removing all accumulated protein avoids misinterpretations and allows pointing out the time that L  lactis is able to secrete recombinant proteins after inducing the activity of the pNis promoter   ,experiment
Towards that end migratory potential of both cell lines was compared using the wound healing assay   ,experiment
All the plants grown from spotted kernels in this family carried MuDR  p but the presence or absence of MuDR  p had no effect on activity   three of ten plants grown from spotted kernels carried MuDR  p as did seven of nine plants grown from pale kernels   ,experiment
The large fold changes result from very small denominators used in the fold change calculations for these probe sets   ,experiment
Finally they assessed the efficacy of rapamycin in combination with paclitaxel in nude mice with cell line xenografts   ,experiment
Whole cell lysates were prepared and subjected to SDS PAGE and immunoblot analysis using anti  CstF  Figure A top panel  anti FLAG  Figure A middle panel  and anti tubulin antibodies  Figure A bottom panel    ,experiment
Using PET subject s brains were scanned while they learnt about the defector s abuse of trust and determined the punishment   ,experiment
Thus more than PPERCENT of the cells with two apparent daughters were monocolor which is far more than the PPERCENT expected for a random population of false  bibudded  cells   ,experiment
The lower dose time course also included a hour treatment or two cell divisions   ,experiment
In the third experiment  CL trans vs  CL exp  genes had a different expression level in transition phase including genes with increased expression  bioB bioY and phoD  and genes with decreased expression  e g  seuC seuB ssuDssuC ssuDand ssuB   Fig  B    ,experiment
In the hormone treated mice only   PPERCENT  produced tumors  p       ,experiment
A performance summary of this experiment is shown in Table   ,experiment
Nevertheless the helices even though their local D structure is perturbed remain docked together   ,experiment
For the operator the pressure fluctuations hamper titration of the desired set airway pressure while the pressure safety alarm limits may be exceeded frequently   ,experiment
The transplants exposed to tamoxifen for only months did not develop any tumors after weeks   ,experiment
The descendants of the AB blastomere that was transiently in contact with Pshow elongated AB derived regions   ,experiment
In experimental manipulations whichever form was most common was most likely to be attacked by ground foraging birds resulting in a survival advantage for the rare form   ,experiment
Western blot of pRE and pRE IRtransfected NA cells   ,experiment
The dim subpopulation had a fold higher survival rate as compared to the sorted bright cells  Fig  C    ,experiment
In three independent experiments we observed that from a total of cultures did grow in Ggrew in blasticidin whereas showed growth in both Gand blasticidin   ,experiment
The antibodies themselves do not shift the probe  lanes    ,experiment
In the Super Shift reaction array a lag band of the  antigen antibody specific probe complex  was observed  Fig  C    ,experiment
In each experiment the ability to detect the heteroplasmic positions for different haplotype ratios with different detection thresholds was tested the number of correct bases were determined and false positives were scored  Table S   ,experiment
The kDa form of Arm is stable as it persists until the late stage of apoptosis at time points when full length Arm is no longer detectable  Fig  C D H    ,experiment
We also saw that Cpositive cells had increased staining intensity as they approached confluence   ,experiment
The amount of Evan s Blue extracted from the bladder tissue was determined spectrophotometrically  nm  and data were expressed in  g  g of bladder weight   ,experiment
These interactions reflect group differences in the pattern of growth   ,experiment
These studies were approved by the University of Alabama at Birmingham Institutional Animal Care and Use Committee   ,experiment
The PPERCENT zymosan data were those derived from Experiment   ,experiment
The three treatments in which seeds were produced did not differ from each other in number of seeds per capsule   ,experiment
In the final experiment we asked whether conversely transfer from arm to wrist could be blocked by a prior history of wrist training   ,experiment
Table shows the performance of miPred and miR KDE for the NHdataset in terms of genus   ,experiment
When comparing some groups  scores there was no need for correction for multiple comparisons t tests were used   ,experiment
To test whether the new FPs retain the low bacterial cytotoxicity of DsRed Expresswe examined colony size for E  coli cells expressing high levels of various FPs     ,experiment
To further study the effect of NPD media on secretion we examined the secretion of monoclonal antibody in cultures grown in reduced serum   ,experiment
In contrast no significant phosphorylation was observed for fusion proteins composing most of TIM the N terminal half of CLK or full length CYC and SGG  Figure    ,experiment
A link between HA ubiquitylation and cellular damage repair was uncovered by the finding that the UV induced enrichment of ubiquitylated HA was absent in the NER deficient XPA XPC XPG and XPF cells but remains intact in the XPV cells which are not defective in NER pathway but carry a mutant DNA polymerase     ,experiment
C  elegans genes with exons of unusual hexamer content as well as those with unusually many exons short exons long introns a weak translation start signal weak splice sites or poorly conserved orthologs posed the greatest difficulty for gene finders   ,experiment
All gene sets will be available from and will also be displayed in the genome browsers for these species at   ,experiment
Levels for all stimuli in Experiment were dBSPL  decibels sound pressure level  well above our participants  hearing thresholds and levels for stimuli in Experiment were similar  with the same code and hardware settings but a different computer    ,experiment
Testis volume  TV  was calculated using the formula  p a bwhere a and b denote half of the length and width respectively   ,experiment
In fact only enhancement mediated by the mutation SF was slightly but significantly higher than the other ones   ,experiment
Blood samples were collected at  and h after the EGCG administration   ,experiment
Overexpression of STAP in NIH Tcells revealed that STAP may regulate cell growth via reducing pexpression   ,experiment
After hrs each cup was examined for remaining larva   ,experiment
The animals were housed under constant temperature   C  and in a h light  dark cycle and maintained on water and food ad libitum   ,experiment
  and   make use of an experiment profiling gene expression in different tissues of Populus trichocarpa  Niqually  the sequenced clone   ,experiment
Little difference was seen between the and  l doses for either Mock or APF treated samples but cells treated with  l of APF or the mock preparation were clearly different from the lower level treatments   ,experiment
In this simulation a dipole is placed near a stationary skate and the dipole is simply rotated in the horizontal plane of the skate without changing its position  Figure    ,experiment
Since the time available to search for suitable habitats and host plants for larval growth and survival is limiting the number of surviving offspring may be higher for females that lay relatively fewer eggs but spend more time searching for oviposition sites  Wiklund and Persson    ,experiment
Similarly the kD IkB   band in the protein of the TC group was affected but later  min  after PH and its levels remained low even at and h  Figure    ,experiment
The average ROC  ROC scores for draws of the data were     for the unflipped data and     for the flipped data   ,experiment
Raw data corresponding to the mean signal intensity of up to spots have been normalized by the mean signals of the microarrays   ,experiment
For two generations removed from selection the dams of the daughters for ovariole number determination were taken from lines in which selection had been relaxed for two generations   ,experiment
Percent germination after one week for ABRtransgenic and WT seeds in the dark and in the presence of light  fluorescent light  mol m s  were compared in Petri dishes at RT   ,experiment
The results showed that cancer cell proliferation could not be reduced   ,experiment
Particularly at the periphery of the plastids the green fluorescence of GFP seemed predominant  arrows  while the fluorescence of Chl was predominant within the chloroplast  asterisks    ,experiment
On the other hand when the same tunnel was lined with axial stripes so that a bee flying through it would experience very little optic flow because the stripes were parallel to the flight direction the bees signaled a very small distance even though they had flown the same physical distance as in the previous condition  Srinivasan et al     ,experiment
Surprisingly no additional RNAs were visualized with either RNA extraction method  Trizol  or Qiagen  not shown  or stress  see conditions in Material and Methods section data not shown    ,experiment
A significant increase in the number of TRP specific IFN   producing cells occurred by days post immunization  Fig     ,experiment
These secondary Abs were used in all the blotting assays of this paper   ,experiment
Unlike the tumors initiated by activated Ras or Wnt pheterozygosity or nullizygosity had no significant impact on the level of cell proliferation  Figure C    ,experiment
Additionally dosage sensitivity is evident in vNB DAand SOG extension phenotypes  Figure g    ,experiment
Placing cto mutants in  M neocuproine at hpf resulted in wavy notochords in the mutant embryos at hpf while having no effect on heterozygous or wild type embryos  Figure A B    ,experiment
We find that the input function of a reporter strain in which the GalS  GalR binding sites in the galE promoter were deleted is monotonic  Figure H    ,experiment
However hybridization of RNA that has been labeled directly by chemical means thus omitting the use of reverse transcriptase usually yielded signals only from the annotated strand   ,experiment
Additional scanning of the novel human dataset yielded potential proteins via SVM and potential proteins via BLAST  threshold  which is in agreement with the unknown status of existence in several human repair pathways     ,experiment
Observations were made on testicular and follicular size at the beginning and the end of the experiment and at monthly intervals during the experiment   ,experiment
Studies looking at plasma histamine levels following morphine administration in humans have shown peak histamine levels within minutes of administration     ,experiment
For very low velocity impacts this is to be expected as it is usually only when the sled acceleration exceeds g s that head acceleration begins to exceed sled acceleration   ,experiment
For very low velocity impacts this is to be expected as it is usually only when the sled acceleration exceeds g s that head acceleration begins to exceed sled acceleration   ,experiment
A subsequent study was conducted to see if using  three video channels  overcame the problems associated with using a single video camera     ,experiment
We illustrate our method with publicly available expression measurements from Dictyostellium discoideum wild type   and deletion mutant strains     ,experiment
We then tested whether those populations would evolve earlier aging   ,experiment
With this assay it can not be determined whether offspring carry an extra Y chromosome   ,experiment
The required computational time of the algorithms are studied with respect to the number of genes to be selected  t  and the size of the whole gene set  d    ,experiment
We do this in two ways  First we measure this accuracy by the Fscore of our predictions on held aside data and compare these scores to those obtained by a restricted version of our algorithm for which the only aspect given to the Train function is multiple binding sites   ,experiment
The other work reported the analysis of Pseudomonas aeruginosa corneal infection using an oligonucleotide microarray     ,experiment
The experiments using inhibition of DNA replication merely measure the pattern of mass increase in a perturbed experimental situation on cells that are not synchronized   ,experiment
We have conducted a DNA microarray experiment using the AFFYMETRIX  array which contains oligonucleotide probe sets representing approximately  genes   ,experiment
Some anorectic animals received processed canned cat feed for a few days to stimulate their appetite   ,experiment
Thus we added purified recombinant HuR to the cytoplasmic extracts and monitored its effect on the endonuclease activity   ,experiment
Demura et al    also examined the change in gene expression in the transdifferentiation of mesophyll cells into xylem cells in Z  elegans   ,experiment
