Overexpression of STAP in NIH Tcells revealed that STAP may regulate cell growth via reducing pexpression   ,experiment
After hrs each cup was examined for remaining larva   ,experiment
The animals were housed under constant temperature   C  and in a h light  dark cycle and maintained on water and food ad libitum   ,experiment
  and   make use of an experiment profiling gene expression in different tissues of Populus trichocarpa  Niqually  the sequenced clone   ,experiment
Little difference was seen between the and  l doses for either Mock or APF treated samples but cells treated with  l of APF or the mock preparation were clearly different from the lower level treatments   ,experiment
In this simulation a dipole is placed near a stationary skate and the dipole is simply rotated in the horizontal plane of the skate without changing its position  Figure    ,experiment
Since the time available to search for suitable habitats and host plants for larval growth and survival is limiting the number of surviving offspring may be higher for females that lay relatively fewer eggs but spend more time searching for oviposition sites  Wiklund and Persson    ,experiment
Similarly the kD IkB   band in the protein of the TC group was affected but later  min  after PH and its levels remained low even at and h  Figure    ,experiment
The average ROC  ROC scores for draws of the data were     for the unflipped data and     for the flipped data   ,experiment
Raw data corresponding to the mean signal intensity of up to spots have been normalized by the mean signals of the microarrays   ,experiment
For two generations removed from selection the dams of the daughters for ovariole number determination were taken from lines in which selection had been relaxed for two generations   ,experiment
Percent germination after one week for ABRtransgenic and WT seeds in the dark and in the presence of light  fluorescent light  mol m s  were compared in Petri dishes at RT   ,experiment
The results showed that cancer cell proliferation could not be reduced   ,experiment
Particularly at the periphery of the plastids the green fluorescence of GFP seemed predominant  arrows  while the fluorescence of Chl was predominant within the chloroplast  asterisks    ,experiment
On the other hand when the same tunnel was lined with axial stripes so that a bee flying through it would experience very little optic flow because the stripes were parallel to the flight direction the bees signaled a very small distance even though they had flown the same physical distance as in the previous condition  Srinivasan et al     ,experiment
Surprisingly no additional RNAs were visualized with either RNA extraction method  Trizol  or Qiagen  not shown  or stress  see conditions in Material and Methods section data not shown    ,experiment
A significant increase in the number of TRP specific IFN   producing cells occurred by days post immunization  Fig     ,experiment
These secondary Abs were used in all the blotting assays of this paper   ,experiment
Unlike the tumors initiated by activated Ras or Wnt pheterozygosity or nullizygosity had no significant impact on the level of cell proliferation  Figure C    ,experiment
Additionally dosage sensitivity is evident in vNB DAand SOG extension phenotypes  Figure g    ,experiment
Placing cto mutants in  M neocuproine at hpf resulted in wavy notochords in the mutant embryos at hpf while having no effect on heterozygous or wild type embryos  Figure A B    ,experiment
We find that the input function of a reporter strain in which the GalS  GalR binding sites in the galE promoter were deleted is monotonic  Figure H    ,experiment
However hybridization of RNA that has been labeled directly by chemical means thus omitting the use of reverse transcriptase usually yielded signals only from the annotated strand   ,experiment
Additional scanning of the novel human dataset yielded potential proteins via SVM and potential proteins via BLAST  threshold  which is in agreement with the unknown status of existence in several human repair pathways     ,experiment
Observations were made on testicular and follicular size at the beginning and the end of the experiment and at monthly intervals during the experiment   ,experiment
Studies looking at plasma histamine levels following morphine administration in humans have shown peak histamine levels within minutes of administration     ,experiment
For very low velocity impacts this is to be expected as it is usually only when the sled acceleration exceeds g s that head acceleration begins to exceed sled acceleration   ,experiment
For very low velocity impacts this is to be expected as it is usually only when the sled acceleration exceeds g s that head acceleration begins to exceed sled acceleration   ,experiment
A subsequent study was conducted to see if using  three video channels  overcame the problems associated with using a single video camera     ,experiment
We illustrate our method with publicly available expression measurements from Dictyostellium discoideum wild type   and deletion mutant strains     ,experiment
We then tested whether those populations would evolve earlier aging   ,experiment
With this assay it can not be determined whether offspring carry an extra Y chromosome   ,experiment
The required computational time of the algorithms are studied with respect to the number of genes to be selected  t  and the size of the whole gene set  d    ,experiment
We do this in two ways  First we measure this accuracy by the Fscore of our predictions on held aside data and compare these scores to those obtained by a restricted version of our algorithm for which the only aspect given to the Train function is multiple binding sites   ,experiment
The other work reported the analysis of Pseudomonas aeruginosa corneal infection using an oligonucleotide microarray     ,experiment
The experiments using inhibition of DNA replication merely measure the pattern of mass increase in a perturbed experimental situation on cells that are not synchronized   ,experiment
We have conducted a DNA microarray experiment using the AFFYMETRIX  array which contains oligonucleotide probe sets representing approximately  genes   ,experiment
Some anorectic animals received processed canned cat feed for a few days to stimulate their appetite   ,experiment
Thus we added purified recombinant HuR to the cytoplasmic extracts and monitored its effect on the endonuclease activity   ,experiment
Demura et al    also examined the change in gene expression in the transdifferentiation of mesophyll cells into xylem cells in Z  elegans   ,experiment
Bacterial lysates containing GST tagged vinculin or paxillin were mixed with lysates containing FLAG Nudel and then subjected to co IP with anti FLAG resin   ,experiment
In k folding the training set is partitioned randomly into k  for example or  subsets   one of these subsets is then selected as the verification set the pandect is constructed on the remainder of the training set  viewed as the learning set  and the prognosis of the pandect is checked on the verification set   ,experiment
Examples of the gain of functional responses  CDupregulation  A  and cytotoxicity  B   to a narrow presentation range of EIINFEKL Kb that parallel with the ppERK responses shown in Figure S  ,experiment
Effects of bFGF and VPA on proliferation of NPCs   ,experiment
In situ hybridization of mitf and dct in these neural fold extirpated tadpoles showed a normal pattern in the anterior but an absence of positive cells in the region of the tail affected by the neural fold extirpation  fig  F G    ,experiment
A peptide containing the binding motif can bind its ligand competitively displacing the normal protein ligand leading to a dose dependent decrease in protein activity   ,experiment
It also allowed us to test for heterogeneity in survival rates among the independently evolved lines   ,experiment
whether they are in or out of the stress context will be given priority for access to long term memory storage   ,experiment
To test this we misexpressed col using the apGALdriver which is not expressed until stage thus maintaining col expression in all four Ap cluster neurons at the time when Col is normally down regulated   ,experiment
Using this assay we determined a phalf life of h in control cells which was increased to more than h in MIB treated cells  Fig  B    ,experiment
Either way increased global movement of humans and agricultural produce and associated parasites may not only increase disease transmission but also result in evolutionary change in levels of parasite infectivity and host resistance   ,experiment
Over the course of minutes    cell cycles  culture samples were fixed every ten minutes with formaldehyde and HKac levels at individual nucleosomes were measured relative to the cell cycle average   ,experiment
The p value represents the correlation between non HS and HS which is significantly different   ,experiment
Such an effect will not preclude cytokine detection when a high protein concentration is measured but hampers the analysis when the concentration of protein is low   ,experiment
To determine whether the effects of Bcl xL occurred early or late in the neoplastic process we examined sections of pancreases from RIP Tag   RIP tva mice at and wk after RCASBP Bcl xL delivery  and wk of age respectively  as well as wk after infection  Figure B and C    ,experiment
As in the spatial task RM and WM errors can now be defined   ,experiment
In cells stably transfected with DNA that expressed wild type LKB but not a catalytically inactive mutant  however the ability of AICA riboside and phenformin to activate AMPK to phosphorylate Thron the AMPKa subunit and to cause phosphorylation of a downstream target  ACC  was restored  Figure    ,experiment
Substitution of these amino acids in the sequence of Lhcba major LHCP that can not be detected in Chl b less plants   would be expected to restore accumulation of the protein with only Chl a   ,experiment
Second is what the absolute number of beads is that is acquired by the instrument attributable to carryover   ,experiment
The development of this method to repair ex vivo the gene defect in isolated human monocytes should have beneficial effects when these cells are re infused in the circulation and retained in the lung to give protection against proteolytic alveolar damage   ,experiment
When the number of basis vectors is the performance seems to be optimized with  mean ROC score   ,experiment
Results may be considered particularly positive for a governmental health promotion website working with a small marketing budget   ,experiment
Therefore we designed now an initial explorative approach to document a basic effectiveness at first   ,experiment
Reassuringly these results are also supported by published in vivo reporter expression experiments and in vitro binding assays of Ndtmutants     ,experiment
Moreover the learning curve indicated that the deck B was relatively more attractive than the other three decks throughout the game  see Additional file    ,experiment
Our proposed solution has been to construct an archive of manuscripts  from previous classes and gathered from the Internet  that allows for a computer based digital check of originality for all newly submitted manuscripts   ,experiment
To test the applicability of the mRNA tagging strategy for obtaining a comprehensive gene expression profile of a specific subset of neurons we utilized this approach to fingerprint a group of larval cells largely composed of A type motor neurons     ,experiment
To determine whether impairment of cholesterol efflux by HIV infection leads to cholesterol accumulation and foam cell formation we loaded macrophages  uninfected or infected with Nef expressing or  Nef HIV  with lipids by incubating with acetylated LDL  AcLDL  in the presence of apoA I and stained cellular lipids with Oil Red O  Figure    ,experiment
In order to further support the involvement if Fgfs in ectopic bud formation we additionally probed control and GataND     embryos with the soluble FgfrFc fusion protein which recognizes several Fgfs     ,experiment
We observed essentially similar results using the other structurally and mechanistically different PIkinase inhibitor  wortmannin    ,experiment
At the end of the treatment period all cells were harvested and analyzed for the phospho ATF level   ,experiment
As a first step toward discovery of the cis element the Bmdsx mini gene which consisted of exon and and internally shortened introns to was constructed and transgenic silkworms expressing this construct was generated   ,experiment
Samples from culture supernatant and PPERCENT ammonium sulphate saturation fraction of S  lividans TK  pOW were included as negative controls  Fig  lanes and    ,experiment
Furthermore LIF treatment led to a twofold increase of nestin positive cells as well as a doubling of the BrdU and nestin double positive cell population  Fig  A C    ,experiment
 ,experiment
Various other methods already analyzed this experiment   the results strongly suggest the toxin is affecting the animal   ,experiment
The targets for Grxshould be the proteins that become reduced at a quicker rate   ,experiment
In the first experiment the global gene expression of the sigB proficient strain RESwas compared to that of the sigB deficient strain CLwhereby both strains were harvested in the exponential growth phase  sample number    ,experiment
Thus the average survival rate dropped to PPERCENT PPERCENT and PPERCENT following mJ  cm mJ  cmand mJ  cmof UVB irradiation respectively  Figure    ,experiment
We then asked how well the top regulators can perform if they are used to build a new aobANN over a sweep that ranges from three to regulators   ,experiment
To confirm that the fragments identified here contain binding sites for nuclear proteins an EMSA was carried out using individual fragments that overlapped with the identified ones  Fig     ,experiment
The day time point was chosen throughout this paper as it is the latest time point we can use before most flies begin to die from the infection   ,experiment
We also investigated their inhibitory effect against other Gram positive pathogenic cocci which possess the homologous YycG  YycF TCS   ,experiment
Double labeling of neuron specific class III beta tubulin and Cre recombinase showed that the majority of striatal neurons express the Cre recombinase driven by the Drda gene  Fig  b    ,experiment
Under these new conditions the activity of L  fermentum CRLwas again assessed by coadministration of the strain with the a GOS rich soy milk   ,experiment
The resulting multispecies Ewere then tested by immunofluorescence using HeLa cells transiently expressing Myc tagged GFP CLIP    Figure    ,experiment
Future brain imaging research can shed light on how individual differences in the brain reward system contribute to strategic decision making in the Ultimatum and Dictator Games   ,experiment
To demonstrate that ATF was phosphorylated the nuclear extracts from Bcells were incubated with protein phosphatase A  PPA  for different periods of time and then ATF protein was detected using an antibody specific for phospho ATF   ,experiment
Since Scells do not express their own PrP M laga Trillo et al  could directly test the effect of exogenous PrP expression on cell adhesion   ,experiment
For a direct comparison of human and murine promoters reporter gene vectors including either TSS A or B were analyzed side by side in Saoscells   ,experiment
To determine whether inhibition of pleads to a decrease in ATF phosphorylation we treated Bcells with or without  M of the pMAPK selective enzyme inhibitor SB  ,experiment
Seven pigmented transformants were cloned and their plasmid DNAs were extracted and analysed by some restriction endonuclease   ,experiment
The controls at the bottom show that all lanes contain the same amounts of DNA to verify that preferential labeling of the kb plasmid is not due to higher amounts of input substrate   ,experiment
Specifically the initial patterns of WRN exonuclease activity on an mer are identical in the presence or absence of ATP but degradation of a mer is significantly better with ATP than without  see Fig  E    ,experiment
Therefore we performed in situ hybridization by using a DR specific riboprobe followed by immunohistochemistry with Cre specific antibody  Fig  c    ,experiment
Strongest inhibition  PPERCENT CAT activity  was seen with the four times selected pool which was significantly increased versus the initial pool  PPERCENT CAT activity   Fig  B    ,experiment
The values are derived from an assessment of approximately cells in random fields in each experiment   ,experiment
In contrast to imd homozygotes flies homozygous for a mutation in Dif a transcription factor in the Toll pathway did not die rapidly  Figure B and C    ,experiment
Figure a shows an immunoprecipitation  anti GFP  plus protein blot  anti Ptc  analysis of extracts from these cells treated for and hours with vehicle nM Hh protein or   M Hh agonist  see Figure e   Hh Ag     ,experiment
The controls showed that the ratio of total flies on food spots to flies free in the chamber was of the same order in all the strains tested  figure  and this again allows us to eliminate major peripheral sensory defects  olfactory or visual    ,experiment
Binding of STATto the endogenous mTARC promoter was also confirmed in ChIP assays using IL treated bone marrow derived M   Figure B  in the presence or absence of a STATblocking peptide   ,experiment
As expected SycE did not co purify with YopEDHFR fusion since this construct does not include the SycE binding site   ,experiment
In addition they used a double mutant strain affecting both orientation of the mitotic spindle and checkpoint control such that both nuclei frequently accumulate in one cell either the mother or daughter   ,experiment
All the M  abscessus and M  chelonae isolates had the same PCR pattern   ,experiment
The PCR product in the template fraction might represent a subpopulation of pre mRNAs for which binding of poly  A  factors has been more rapid or efficient so they have remained tethered to the polymerase even after cleavage at the  ribozyme   ,experiment
The results of this experiment are shown in Fig  B   ,experiment
Therefore we cloned the rat Tub  UTR and tested it for RNA localization activity using the Xenopus oocyte assay   ,experiment
Competence as well as sporulation is monitored by the cell using subtle cues most of which are still unknown   ,experiment
Flowers showing white sectors also exhibited coordinated transformation of petals to sepals and both stamens and staminodia to carpels  Figure    ,experiment
On the other hand for Yeast which was curated largely from abstracts the figure was PPERCENT   ,experiment
Again we analyzed the nuclear distribution of  TERM pA pre mRNA transcripts by RT PCR using the nuclear fractionation protocol  Figure D  and show that nearly all  PPERCENT  of   globin pre mRNA is located in the template fraction  lane  with only a small amount released into the nucleoplasmic fraction  lane    ,experiment
In a second experiment we also evaluated the classification accuracy of the method with the test set included in the reference set i e  in this case the fragments of each genome were taxonomically classified using all genomes as a reference   ,experiment
Heat killed S cells were also harmless but when live R cells were mixed with killed S cells and injected into mice the mice died and the bacteria re isolated from those mice had been  transformed  into the S type   ,experiment
As expected the classification accuracy drops by  PPERCENT   ,experiment
Permeabilization of virion particles with  PPERCENT NP abolished the protection of capsid and endophilin and these proteins were then degraded even at low concentration of protease  Figure b    ,experiment
In the present study we found that exogenously added heparin had a stronger inhibitory effect on the cytotoxic activity of the peptides compared to CS   ,experiment
As an internal control no obstruction of actin flow was observed at the unblocked side of the cell cortex   ,experiment
However since r  N X  is a global measure that uses information on both N and X we can not conclude that cc  N X  can be predicted from N alone   ,experiment
No signs of nonspecific toxicity were detected by histopathological evaluation of organs   ,experiment
Consistent with this possibility addition of an anti collagen antibody led to a substantial reduction in the average cell speed at later stages of cell movement probably due to shielding of both the collagen IV binding sites and the bindings sites of other ECM components by the antibody molecules binding to the gradually accumulating newly secreted collagen IV   ,experiment
Once again we resorted to affinity chromatography incubating in vitro translated S Met labeled SMADand SMADwith a resin containing His ZZ MABL  ,experiment
The progression of the remaining cells through S  M was delayed slightly by a amanitin  Figure A  but importantly despite decreased cell cycle transcription  Figure B  the daughter cell size profile of the a amanitin treated culture was essentially identical to that of the control cells  Figure C  M amanitin    ,experiment
Cytokinesis defects were observed in control  dma  cells as well as dma  cells overproducing Nucp  Figure A    ,experiment
Figure B  inset  shows that the indicated tau peptide   is able to assemble in the presence of APS   ,experiment
The distribution of bacteria seen using the two GFP constructs was similar  unpublished data    ,experiment
Therefore the real number of Atfp  Atfp targets is probably considerably higher than the conservative estimate from our previous study     ,experiment
These two glomeruli are also often ectopically innervated by lola    PNs from the opposite lineage  that is DAis ectopically targeted by lola    adPNs while VAd is ectopically targeted by lola    lPNs    ,experiment
The mean time to death was lengthened by d in the two eiger mutants tested  Figure A    ,experiment
We also need to point out that the topology accuracy error rate decreases with the increase of input sequence length   the error rate also increases with the increase of indel rate because for these datasets the alignment is more difficult   ,experiment
As anticipated we observed no HA pin particles  Figure d   lane versus lane  while substantial levels of HA nucwere recovered in virions  Figure d   lane versus lane    ,experiment
Thus we routinely used the ratio of  g per  mg particles   ,experiment
The levels of incorporated endophilin inside the virions quickly reached a plateau and no higher levels were found even with dramatically increasing amounts of endophilin expressed inside the cells  Figure    ,experiment
In the maturation process of cells from the colonic crypt the stem cells differentiate to become either goblet cell in the crypt or surface epithelial cell     ,experiment
The same result occurred after h of culture   ,experiment
The reverse transcriptase activity of culture medium displayed at most a two fold reduction compared to controls  Figure b    ,experiment
In agreement with the filter lift assays constructs containing MA showed the strongest reporter gene expression   ,experiment
After transplantation cells from the more caudal transplanted streak turned on Soxexpression in all cases  n   Figure C C  C  C   and C   insets  but were unable to maintain expression after overnight incubation   Figure E E  E     ,experiment
Addition of Grxwithout addition of GSH or another reducing agent resulted in rapid reversal of the reaction and deglutathionylation the protein   ,experiment
Western blot analysis of multiple subunits revealed a markedly reduced amount of Rpcp in the Pol III complex containing Rpc p  Figure A lane  relative to wild type Rpcp  Figure A lane    ,experiment
Thus it is unlikely that our reranking setup resulted in different conclusions than if the retrieval had been performed on the entire corpus   ,experiment
Mice from the BALB and Bstrains were tested  N  mice from three to four litters per strain    ,experiment
PPI phenotypes at each of the prepulse sounds  and dB  were measured for the four inbred strains  BCBALB and DBA  where the numbers of mice measured were and for males in BCBALB and DBA respectively and were and for females in BCBALB and DBA respectively   ,experiment
Experiment   ,experiment
Previous research has suggested that any personalisation of approach helps to improve the response rate   ,experiment
Experiment   ,experiment
The second test used trajectories generated by human subjects while tracking geometrically prescribed complex figural forms   cloverleaves lemniscates and lima ons   during both drawing and locomotion   ,experiment
To improve the performance of SRL on biomedical literature we add two domain specific features NE features and argument template features  denoted as BIOSMILENE and BIOSMILETemplate respectively  to BIOSMILE   ,experiment
The inhibition by Histaminum and Apis is particularly interesting because when released at normal doses into a tissue both histamine and bee venom have pro inflammatory powers and irritant properties   ,experiment
The results of this experiment show that although increasing the cognitive load  by increasing the set size from two to ten  yields the expected increase in diotic identification thresholds it does not change binaural benefits   ,experiment
As we demonstrate in Methods if we consider mand mto be the same motif the resulting combined motif has expected count    and observed count k kin the group   ,experiment
Such normalizations also make the PPCA simple     ,experiment
