Kumar and colleagues   recently reported on the feasibility of laparoscopic pyeloureterostomy in a similar case with excellent results   ,experiment
The majority of our patients  or or PPERCENT  were intubated at outlying facilities and received varied therapy before transfer to our institution   ,experiment
Substantial knowledge has been gained of the intellectual   neurocognitive   and psychiatric state   of patients with phenylketonuria  PKU McKusick    ,experiment
The authors were considered  expert  clinicians each having over years of occupational therapy experience in public and private health sectors and had attended short skills based courses on evidence based practice   ,experiment
Although high winds were blowing sand from the treated fields no odour was evident at that time   ,experiment
Thus when an eructation occurs to vent the stomach of swallowed gas fish oil at the gas fluid interface in the stomach may be partly regurgitated and tasted   ,experiment
Practitioners midwives and nurses who are responsible for population based health care services in the primary health care system became the most important human resource for surveillance during the avian influenza outbreak in Turkey   ,experiment
Besides AS plus AQ the current WHO malaria treatment guidelines recommend three different ACTs  artemether lumefantrine  six dose regimen  AS plus mefloquine and AS plus sulphadoxine  pyrimethamine  SP  that are being used in South America     ,experiment
The PIH EMR is also used to create monthly reports for the Global Fund and the Health Ministry   ,experiment
Output harmonisation secures comparability yet allows for diversity as to the variables that are collected   ,experiment
Mass treatment of the entire population with anti malarial drugs was performed on many occasions in the eradication programmes of the s and s and has been employed sporadically since then   ,experiment
In other words when all three factors were enhanced patients  conditions began recovery to normal health   ,experiment
Due to the profound bleeding no clear cause could be identified and unfortunately the family of the patient refused a post mortem examination   ,experiment
As outlined in more detail below the course involved first teaching a set of basic principles and then applying them to a broad range of topics   ,experiment
Successful cure was achieved with local BCG treatment   ,experiment
The authors  draw on first hand experience   of the secondary contamination experienced during the Tokyo sarin release in   ,experiment
The further analysis of the biological and clinicopathological parameters showed that patients with higher nodal stage expressed significantly higher IL serum levels   ,experiment
The numbers assigned at the scene were not site specific and caused initial problems in identifying victims   ,experiment
Non randomized studies that have examined this issue have found that clinically relevant tracheal stenosis was uncommon in PDT when performed by experienced operators in a long term study of patients     ,experiment
People may undergo a health experience such as a severe hypoglycaemia   ,experiment
We appreciated the importance of including a variety of expertise among members of the GLIA team   ,experiment
In this project the prototypes were tested in five countries in two practices each   ,experiment
The first intervention consisted of a basic training experience for clinicians but its implementation into practice appeared limited by inattention to contextual issues   ,experiment
Alternatively this belief may be based on the actual experience of professionals in this study that it is more difficult to calm an infant at risk for neurological impairment   ,experiment
It is not until their third and fourth years that students have significant outpatient exposure to screening in practice   ,experiment
Meanwhile the pH  and stress related genes that we and others have characterized continue to appear in the literature as among the top gene expression findings in comparative studies for a variety of diseases and conditions     ,experiment
Robotic telepresence started as a method for remote minimally invasive surgery     ,experiment
Clinical poisoning cases occurred after a few weeks of exposure with a total dose of about mg   ,experiment
The mg dose we used was comparable to those used in other studies and within the   mg dose range frequently used for treating depression   ,experiment
From the end of all netting items were again zero rated for VAT and the VAT on imports of inputs  mainly the yarn  can be re claimed against proof that the material was used for netting manufacture   ,experiment
The present study describes the inability to induce preterm delivery in pregnant rats using live or killed E  coli   ,experiment
Furthermore the New York State Cardiac Surgery database for CABG following non Q wave myocardial infarction demonstrates no increase in risk for mortality  adjusted odds ratio  PPERCENT confidence interval          when surgery is performed days following presentation when compared with CABG for all other classes of angina  mortality  PPERCENT      ,experiment
Even the most productive of American imperialists as Anderson shows were laid low by  tropical neurasthenia  and the disease called  philippinitis    ,experiment
The recommended regimen for empirical antibiotic treatment in this region is a combination of penicillin G or ampi cillin and an aminoglycoside which provided an overall coverage of PPERCENT   ,experiment
A lower incidence of antibiotic resistant Gram negative bacteraemia was similarly observed in the months after the surgery   ,experiment
Previous studies have shown that the length of the questionnaire effects the response rates and that a shorter version promotes the propensity to response     ,experiment
Long lasting neuroadaptations in mesolimbic structures particularly in the nucleus accumbens  NAc  influence behavioural responses to emotional stimuli   ,experiment
In their pioneering work Wiesel and Hubel   demonstrated that when vision from one eye was deprived during the critical period the ocular dominance column for the non deprived eye became dominant   ,experiment
In TCM s long course of development it has absorbed the quintessence of classical Chinese philosophy culture and science and summarized the experience of the Chinese people in fighting diseases     ,experiment
Input from ICU clinician managers with a background in or special knowledge of ethics would be particularly beneficial because they would possess the language to describe what most feel by intuition   ,experiment
The ChIP experiment of Figure E in which FLAG tagged HB was probed supports the conclusion that the bp regions between HS sites in Figure are occupied by nucleosomes   ,experiment
Moreover ablating one of the two putative Polo binding sites on Mtrm by mutation prevents the physical interaction between Polo and Mtrm and renders the mutated Mtrm protein functionless   ,experiment
Athymic nude mice were maintained under the same conditions in a germ free environment   ,experiment
Plasmids DNAs were prepared from these orange colonies and subjected to Pst I Sph I Bam HI digestion   ,experiment
Therefore for the calendar year of he and a colleague from his arctic explorations ate a diet consisting of meat and fat for months   ,experiment
These artificially generated conditioned fear memories were not transient   they lasted at least days indicating that mice will condition as readily to ACC stimulation as they might to shock delivery   ,experiment
The deletion abolished silencing at the HMR locus to the same extent as did deletion of the SIRgene  Figure    ,experiment
Remarkably despite undetectable levels of sequence identity TrpF and HisA that catalyze the Amadori rearrangements can be interconverted by directed evolution  starting with TrpF a single point mutation at the end of the fifth   strand was found to confer the ability to catalyze the HisA reaction while retaining the TrpF reaction     ,experiment
We chose the pair of phenotypes MXDRNK and ttth one of the electrophysiological measures  as the bivariate phenotype to perform the main simulation of linkage with unlinked markers in which we ran  replicates   ,experiment
For these baseline environmental preference measurements juvenile mice from the A BALB Band DBA strains were examined  N  mice from seven to eight litters per strain    ,experiment
Following the conditioning protocol of Experiment a total of mixed BALB  Bsocial groups were examined  N  mice from litters per strain    ,experiment
Furthermore each participant was required to perform the same game twice to trace long term participant preferences after the completion of first trials in the modified IGT   ,experiment
ProtocolSubjects GroupMaleFemaleAgeUE FMEP Joysticks  Able BodiedN  AStroke Induced Arm ImpairmentLow    High    EP TheraDrive  Stroke Induced Arm ImpairmentLow    High    EP Posture Study  Able BodiedN  AUE FM   Upper Extremity Fugl Meyer   ,experiment
Full text papers for these samples were subjected to a  pseudo curation  procedure in which the paper was read by an expert and instead of being fully curated was only scored with respect to its  curatability  for containing a TFBS  see Materials and methods    ,experiment
To check whether fgfexpression was actually silenced in the transformed cells immunohistochemistry with an antibody to GFP was performed on whole mount embryos and on sections after fgfin situ hybridization   ,experiment
The dose dependent transcriptional responses probably directly reflect the dose of bacteria in the tissue and also due to the lag phase in bacterial growth different durations of inflammation in the tissue   ,experiment
The resulting nonlinear steady state response curves provided an estimate of the true f null cline  henceforth referred to as fL    ,experiment
Because catenanes were seen under conditions where either bla was fully functioning  pREC  or impaired  pKNOT  it does not seem likely that catenanes block replication and transcription  or cause mutagenesis    ,experiment
We suspect that   globin mRNA was in excess of the probe level used in these experiments and tested this assumption by using a large excess of probe to analyze   globin mRNA by northern blot  Figure B    ,experiment
The recombinant virus not only predisposed these mice to gliomas but MoMuLV also efficiently tagged oncogenes in the brain potentially collaborating with PDGF     ,experiment
Therefore the hypothesis of a global change of conformation of poly  CA    poly  TG  induced or stabilized by supercoiling had to be ruled out   ,experiment
We further verified this by in vitro transcription  translation with the plasmid constructs followed by reporter gene expression analysis  Fig     ,experiment
Hence our experimental design for providing a definitive test of the fate of prospective endoderm and mesoderm cells of the streak included transplanting the more caudal rostral streak cells which contains prospective endoderm cells not contributing to the midline floor of the foregut     ,experiment
These may be isoforms generated by alternative splicing  i e  ELP b  or proteolytic fragments of ELP a   ,experiment
EV mg  rat reduced intakes of a saccharin solution  no ethanol  but produced less reduction in intake of a sugar solution     ,experiment
Body weights of hamsters pre treated with h versus h melatonin were also lower through Week  F      d f      p       ,experiment
Entrainment parameters were assessed with two factor analysis of variance  ANOVA  with photoperiod  LD vs SD  and melatonin pre treatment duration  h vs h  as independent factors  Statview    SAS Institute Cary NC    ,experiment
Correlation coefficients r routinely exceed  over the range of mg     ,experiment
We conclude that barrel cortex firing rate on each trial predicts the animal s judgment of texture   ,experiment
During the Second World War another oft cited study was performed this time examining the practicality of pemmican  a mixture of dried meat and fat  as a light weight emergency ration for soldiers   ,experiment
For example it is known   that Stenull mutant cells are unable to mate or to arrest the cell cycle   ,experiment
Hence bringing these levels of speech processing together and utilizing subtle featural differences such as lip rounding in experiments that do require natural speech recognition will help to disambiguate the role of the beta ERD seen here   ,experiment
There are only few data relating the metabolic consequences of feeding diets very low in n fatty acids   ,experiment
The amount of soluble and non soluble protein for each mutant was analyzed by western blotting as shown in Figure using anti GFP for the detection   ,experiment
On the otherhand in heminested PCR assay using same annealing temperature only one single band of bp size was produced at the second PCR reaction  fig    ,experiment
Mhuman melanoma cells expressing Casedisplayed a nice high dynamic range response to ATP at a final concentration of  M  Figure e h    ,experiment
In order to ascertain whether this is the case we assessed responsiveness to LIFDex of a representative panel of cluster   genes in the presence  absence of the protein synthesis inhibitor cycloheximide  Figure E    ,experiment
Strikingly introduction of a bulge in the pri miR a stem  UC   GU  made its processing more efficient and completely independent of the presence of hnRNP A Figure C    ,experiment
Two experiments were performed on adult male house sparrows  Passer domesticus  caught around Lucknow city    N   E  and quarantined in an outdoor aviary for days   ,experiment
Nevertheless these papers do not analyze the solutions by the MI based measures as we do here   ,experiment
The percentage of metaphase chromosome spreads  n    showing HKmstaining was analysed in undifferentiated clone ES cells which expressed Xist for d  lane  or were further grown without inducer for h  lane  or h  lane    ,experiment
A recent paper reported that knocking down RGA along with its paralog RGA resulted in changes in the boundary of anterior and posterior domains of PAR proteins in the early embryo     ,experiment
We have previously shown that lack of lectin signal from IgG corresponds well to complete hydrolysis of the chitobiose core of the IgG glycan as analyzed by mass spectroscopy of hydrolyzed IgG     ,experiment
Figure F shows the merge between Nissl staining  C  GFAP immunoreactivity  D  and GluRexpression  E  in the lamina IX in the cervical region of four week old wobbler mice   ,experiment
Subsequently the RNA synthesis in this region was analysed by RT PCR in cells growing exponentially in minimal medium   ,experiment
The results obtained using a single dose of scrapie inoculum were then re evaluated using the same dose of cytokines and different doses of scrapie inocula  data not shown    ,experiment
NA cells were selected for this experiment in favour of the NIHTcells shown above due to a higher ratio of nucleus to cytoplasm   ,experiment
To analyse this further we combined the data generated from all oligos that covered the transcribed regions in order to compare the expression profiles of the sense and antisense tags over time  Figure c f    ,experiment
Consistent with the findings above KTSLPtg animals also developed B LPD only during the neonatal period which disappeared later in life despite elevated serum TSLP levels  Figure D and E    ,experiment
In a parallel staining the cells were probed with MitoTracker and merging of the pictures indicated an identical pattern   ,experiment
Pre treatment of microsomes with Proteinase K however resulted in the loss of signal for BnDGATon the Western blot  Figure lane  suggesting that the N terminal segment of the enzyme was digested by the proteinase in microsomal vesicles   ,experiment
Subcellular localization of Cx protein variants in transfected NIHTcells  Confocal laser scanning imaging of the subcellular distribution of EGFP and the Cx EGFP fusion protein constructs in NIHTcells   ,experiment
Lacking a suitable antibody for immunoprecipitation of CHOP we measured CHOP protein stability instead by immunoblot after treatment of stressed cells with the protein synthesis inhibitor cycloheximide   ,experiment
The predictable exception was a mAb that only recognizes denatured geminon blots and would not be expected to bind native complexes   ,experiment
In the complementary experiment pro Th explants do not express Shh    and only rarely the Th marker Gbx   after hours in culture  Figure c  while pro ZLI  pro Th explants express both genes in the majority of cases     Figure d    ,experiment
The spectral profile of this component is concentrated mainly in the delta range     Hz  and is unlikely to cause the modulations observed in the beta and gamma ranges   ,experiment
When we reintroduced the wild typeDatransgene into the mutantP DorP EYbackground by using OKGAL  a driver with expression in several elements of the giant fiber circuit  including the giant fiber DLMmn TTMmn and PSI  we were able to fully rescue the activation of the DLM by giant fiber stimulation  Figure B andC    ,experiment
After hours in the presence of thiamine intracellular thiamine already reached a maximum while with benfotiamine an important lag period was observed   ,experiment
In the presence of a morpholino the GFP pri miR mRNA level is higher compared to control embryos that were not injected with morpholinos   ,experiment
Experimental details and further analysis can be found in Futschik et al      ,experiment
Figure B shows that greater summed probe item similarity  left side of each pair  predicts greater probability of a Yes response  paired T test for conditions a and b showed p    for c and d p       ,experiment
We wanted to assess directly whether this species is heterotypic  i e  CenHHA HB and H or homotypic  i e  two copies each of CenHand H   ,experiment
Due to the following acquisition sequence  MART Jurkat  gpMART Jurkat  MART Control Jurkat  gpand Control Jurkat  MART  we believe that carry over of the MART Jurkat  MART tetramer sample caused background staining in Control Jurkat  gptetramer   ,experiment
We reproduced these values on the stereomicroscope and then tested the response of wild type animals to these different wavelengths at these powers   ,experiment
As expected NBI stimulated IGF dependent proteoglycan synthesis in a dose dependent manner  Fig  a  but RIGF activity which by itself was highly enhanced compared with IGF remained unaffected by NBI  Fig  b    ,experiment
PC M cells were incubated in suspension over a period of days and then assessed by flow cytometry for uPAR cell surface levels   ,experiment
Perhaps the most surprising result is the apparent systemic effect of the hormones   ,experiment
Therefore the effect of two PKC inhibitors GFX which inhibits all PKC isoforms and G which only inhibits classical isoforms on the growth inhibiting effects of vincristine on SK N BE   cells was investigated  Figure Table    ,experiment
To model the state of detachment in which cancer cells must exist during metastasis both cancer cell lines were placed in forced suspension culture and incubated in suspension over a period of days during which the numbers of early apoptotic vs  live cells were quantitatively scored   ,experiment
Our time correlated evaluation of IP secretion at different times removing all accumulated protein avoids misinterpretations and allows pointing out the time that L  lactis is able to secrete recombinant proteins after inducing the activity of the pNis promoter   ,experiment
Towards that end migratory potential of both cell lines was compared using the wound healing assay   ,experiment
All the plants grown from spotted kernels in this family carried MuDR  p but the presence or absence of MuDR  p had no effect on activity   three of ten plants grown from spotted kernels carried MuDR  p as did seven of nine plants grown from pale kernels   ,experiment
The large fold changes result from very small denominators used in the fold change calculations for these probe sets   ,experiment
Finally they assessed the efficacy of rapamycin in combination with paclitaxel in nude mice with cell line xenografts   ,experiment
Whole cell lysates were prepared and subjected to SDS PAGE and immunoblot analysis using anti  CstF  Figure A top panel  anti FLAG  Figure A middle panel  and anti tubulin antibodies  Figure A bottom panel    ,experiment
Using PET subject s brains were scanned while they learnt about the defector s abuse of trust and determined the punishment   ,experiment
Thus more than PPERCENT of the cells with two apparent daughters were monocolor which is far more than the PPERCENT expected for a random population of false  bibudded  cells   ,experiment
The lower dose time course also included a hour treatment or two cell divisions   ,experiment
In the third experiment  CL trans vs  CL exp  genes had a different expression level in transition phase including genes with increased expression  bioB bioY and phoD  and genes with decreased expression  e g  seuC seuB ssuDssuC ssuDand ssuB   Fig  B    ,experiment
In the hormone treated mice only   PPERCENT  produced tumors  p       ,experiment
A performance summary of this experiment is shown in Table   ,experiment
Nevertheless the helices even though their local D structure is perturbed remain docked together   ,experiment
For the operator the pressure fluctuations hamper titration of the desired set airway pressure while the pressure safety alarm limits may be exceeded frequently   ,experiment
The transplants exposed to tamoxifen for only months did not develop any tumors after weeks   ,experiment
The descendants of the AB blastomere that was transiently in contact with Pshow elongated AB derived regions   ,experiment
In experimental manipulations whichever form was most common was most likely to be attacked by ground foraging birds resulting in a survival advantage for the rare form   ,experiment
Western blot of pRE and pRE IRtransfected NA cells   ,experiment
The dim subpopulation had a fold higher survival rate as compared to the sorted bright cells  Fig  C    ,experiment
In three independent experiments we observed that from a total of cultures did grow in Ggrew in blasticidin whereas showed growth in both Gand blasticidin   ,experiment
The antibodies themselves do not shift the probe  lanes    ,experiment
In the Super Shift reaction array a lag band of the  antigen antibody specific probe complex  was observed  Fig  C    ,experiment
In each experiment the ability to detect the heteroplasmic positions for different haplotype ratios with different detection thresholds was tested the number of correct bases were determined and false positives were scored  Table S   ,experiment
The kDa form of Arm is stable as it persists until the late stage of apoptosis at time points when full length Arm is no longer detectable  Fig  C D H    ,experiment
We also saw that Cpositive cells had increased staining intensity as they approached confluence   ,experiment
The amount of Evan s Blue extracted from the bladder tissue was determined spectrophotometrically  nm  and data were expressed in  g  g of bladder weight   ,experiment
These interactions reflect group differences in the pattern of growth   ,experiment
These studies were approved by the University of Alabama at Birmingham Institutional Animal Care and Use Committee   ,experiment
The PPERCENT zymosan data were those derived from Experiment   ,experiment
The three treatments in which seeds were produced did not differ from each other in number of seeds per capsule   ,experiment
In the final experiment we asked whether conversely transfer from arm to wrist could be blocked by a prior history of wrist training   ,experiment
Table shows the performance of miPred and miR KDE for the NHdataset in terms of genus   ,experiment
When comparing some groups  scores there was no need for correction for multiple comparisons t tests were used   ,experiment
To test whether the new FPs retain the low bacterial cytotoxicity of DsRed Expresswe examined colony size for E  coli cells expressing high levels of various FPs     ,experiment
To further study the effect of NPD media on secretion we examined the secretion of monoclonal antibody in cultures grown in reduced serum   ,experiment
In contrast no significant phosphorylation was observed for fusion proteins composing most of TIM the N terminal half of CLK or full length CYC and SGG  Figure    ,experiment
A link between HA ubiquitylation and cellular damage repair was uncovered by the finding that the UV induced enrichment of ubiquitylated HA was absent in the NER deficient XPA XPC XPG and XPF cells but remains intact in the XPV cells which are not defective in NER pathway but carry a mutant DNA polymerase     ,experiment
C  elegans genes with exons of unusual hexamer content as well as those with unusually many exons short exons long introns a weak translation start signal weak splice sites or poorly conserved orthologs posed the greatest difficulty for gene finders   ,experiment
All gene sets will be available from and will also be displayed in the genome browsers for these species at   ,experiment
Levels for all stimuli in Experiment were dBSPL  decibels sound pressure level  well above our participants  hearing thresholds and levels for stimuli in Experiment were similar  with the same code and hardware settings but a different computer    ,experiment
Testis volume  TV  was calculated using the formula  p a bwhere a and b denote half of the length and width respectively   ,experiment
In fact only enhancement mediated by the mutation SF was slightly but significantly higher than the other ones   ,experiment
Blood samples were collected at  and h after the EGCG administration   ,experiment
